title,doi,storage_size,authors,affiliations,author_order,funders,keywords,fieldOfScience,publication_date
Livestock and kangaroo grazing have little effect on biomass and fuel hazard in semi-arid woodlands,10.5061/dryad.xgxd254c9,69993,Samantha Travers|David Eldridge|Terry Koen|James Val|Ian Oliver,UNSW Sydney|UNSW Sydney|NSW Department of Planning and Environment|NSW Department of Planning and Environment|NSW Department of Planning and Environment,Creator and Contributor(s),NSW Office of Environment & Heritage|National Parks and Wildlife Service,Fire hazard|Fire management |fuel load|Ordinal logistic regression|Fuel load |Sheep,,2020-08-14
Long-term climate impacts of large stratospheric water vapor perturbations: Postprocessed MiMA data (Part 2),10.5061/dryad.sbcc2frfx,199108028735,Martin Jucker|Chris Lucas|Deepashree Dutta,UNSW Sydney|Bureau of Meteorology|UNSW Sydney,Creator and Contributor(s),,Atmospheric science|Climate modeling|Volcanoes,Earth and related environmental sciences,2024-07-16
Long-term climate impacts of large stratospheric water vapor perturbations: Postprocessed WACCM data (Part 3),10.5061/dryad.gxd2547v6,241881611356,Martin Jucker|Chris Lucas|Deepashree Dutta,UNSW Sydney|Bureau of Meteorology|UNSW Sydney,Creator and Contributor(s),,Atmospheric science|Climate modeling|Volcanoes,Earth and related environmental sciences,2024-07-16
Low- versus standard-dose alteplase in acute lacunar ischemic stroke: the ENCHANTED trial - online supplemental,10.5061/dryad.t1g1jwt0s,283248,Zien Zhou|Candice Delcourt|Chao Xia|Sohei Yoshimura|Cheryl Carcel|Takako Torii-Yoshimura|Shoujiang You|Alejandra Malavera|Xiaoying Chen|Maree Hackett|Mark Woodward|John Chalmers|Jianrong Xu|Thompson Robinson|Mark Parsons|Andrew Demchuk|Richard Lindley|Grant Mair|Joanna Wardlaw|Craig Anderson,George Institute for Global Health|George Institute for Global Health|George Institute for Global Health|George Institute for Global Health|George Institute for Global Health|George Institute for Global Health|Second Affiliated Hospital of Soochow University|George Institute for Global Health|George Institute for Global Health|George Institute for Global Health|George Institute for Global Health|George Institute for Global Health|Shanghai Jiao Tong University|NIHR Leicester Cardiovascular Biomedical Research Unit|UNSW Sydney|University of Calgary|George Institute for Global Health|University of Edinburgh|University of Edinburgh|George Institute for Global Health,Contributor(s) Only,"The Stroke Association of the UK|A research grant from Takeda for conduct of the study in China*|The National Health and Medical Research Council (NHMRC) of Australia|A research grant from Takeda for conduct of the study in China|The Ministry for Health, Welfare and Family Affairs of the Republic of Korea *|The National Health and Medical Research Council (NHMRC) of Australia*|The Stroke Association of the UK*|The Ministry for Health, Welfare and Family Affairs of the Republic of Korea|The Ministry of Health and the National Council for Scientific and Technological Development of Brazil *",,,2021-03-14
Male dingo urinary scents code for age class and wild dingoes respond to this information,10.5061/dryad.ttdz08m3d,90671,Benjamin J. J. Walker|Mike Letnic|Martin P. Bucknall|Lyn Watson|Neil R. Jordan,UNSW Sydney|UNSW Sydney|UNSW Sydney|Dingo Discovery and Research Centre|UNSW Sydney,Creator and Contributor(s),UNSW Sydney,communication|scent marking|Sensory systems|olfaction|GC-MS|Physiology|honest signalling|urine VOCs,Biological sciences,2024-03-14
Marabou Stork Stable Isotope and Trace Metal Data,10.5061/dryad.pg4f4qrm2,62412,Roxane Francis|Richard Kingsford|Kate Brandis|Michael Murray-Hudson,UNSW Sydney|UNSW Sydney|UNSW Sydney|University of Botswana,Creator and Contributor(s),Taronga Conservation Society**|Taronga Conservation Society*,,Biological sciences,2021-01-20
Marine heatwave conditions drive carryover effects in a temperate sponge microbiome and developmental performance,10.5061/dryad.f4qrfj70r,671818355,Francesca Strano|Valerio Micaroni|Torsten Thomas|Lisa Woods|Simon Davy|James Bell,Victoria University of Wellington|Victoria University of Wellington|UNSW Sydney|Victoria University of Wellington|Victoria University of Wellington|Victoria University of Wellington,Contributor(s) Only,Victoria University of Wellington,,Biological sciences,2023-06-07
Measuring Acculturation and Health of Indian Women Living in Australia (MAHILA) study questionnaire,10.5061/dryad.3r2280gfz,389212,Cathy O'Callaghan|Uday Narayan Yadav|Sudha Natarajan|Saroja Srinivasan|Ritin Fernandez,UNSW Sydney|UNSW Sydney|Resourceful Australian and Indian Network Inc.|Resourceful Australian and Indian Network Inc.|University of Wollongong,Creator and Contributor(s),"Multicultural Health Service, South Eastern Sydney Local Health Service|Multicultural Health Service, South Eastern Sydney Local Health Service*",,Health sciences,2021-05-04
Measuring plant biomass remotely using drones in arid landscapes,10.5061/dryad.xwdbrv1g1,108946,Justin McCann|David Keith|Richard Kingsford,UNSW Sydney|UNSW Sydney|UNSW Sydney,Creator and Contributor(s),Bush Heritage Australia*,biomass estimation,Biological sciences,2022-04-29
Mechanical test on different elastomer materials based on the ASTM D412-16 standard,10.5061/dryad.kd51c5bbw,114318,Mohsen Hatami|Nicholas Kent|Thomas Whyte|Lynne Bilston,UNSW Sydney|Neuroscience Research Australia|Neuroscience Research Australia|Neuroscience Research Australia,Creator Only,National Health and Medical Research Council,Natural Rubber|ASTM D412-16|Mechanical properties|EPDM rubber strength|ASTM D412-16 tensile testing|neoprene|Neoprene rubber strength|Polyurethane strain rate sensitivity|Polyurethane|EPDM|Neoprene rubber|EPDM rubber|tensile strength|Natural rubber strength|Polyurethane strength|High strain rate tensile testing,Mechanical engineering,2025-07-23
Meta-analysis reveals materiomic relationships in major ampullate silk across the spider phylogeny,10.5061/dryad.sbcc2fr4g,105288,Hamish Craig|Dakota Piorkowski|Michael Kasumovic|Shinichi Nakagawa|Sean Blamires,RIKEN|Tunghai University|UNSW Sydney|UNSW Sydney|UNSW Sydney,Contributor(s) Only,,,Biological sciences,2020-09-16
"Metabolic traits are shaped by phylogenetic conservatism and environment, not just body size",10.5061/dryad.d7wm37qb7,1068188,Lily Leahy|Steven L. Chown|Hannah L. Riskas|Ian J. Wright|Amelia G. Carlesso|Ian J. Hammer|Nathan J. Sanders|Tom R. Bishop|Catherine L. Parr|Heloise Gibb,La Trobe University|Monash University|La Trobe University|Western Sydney University|Deakin University|The University of Melbourne|University of Michigan|Cardiff University|University of Liverpool|Deakin University,Unknown,Leverhulme Trust|Australian Research Council,ventilation pattern|Discontinuous gas exchange|standard metabolic rate,Biological sciences,2025-07-30
Monitoring the evolution of relative product populations at early times during a photochemical reaction,10.5061/dryad.nzs7h44wm,10000456542,Joao Pedro Figueira Nunes|Matthias Hoffmann|Andrew Attar|Xiaozhe Shen|Duan Luo|Sri Bhavya Muvva|Artem Rudenko|Anbu Venkatachalam|Rebecca Boll|Xijie Wang|Yanwei Xiong|Sajib Kumar Saha|Kurtis Borne|Surjendu Bhattacharyya|Kyle Wilkin|Christopher Hansen|Jie Yang|Ruaridh Forbes|Lea M. Ibele|Arnaud Rouzee|Martin Centurion|Ming-Fu Lin|Nathan Goff|Stephen Weathersby|Benjamin Erk|Thomas Wolf|Shashank Pathak|Matthew Ware|Alex Reid|Rebecca Ingle|Michael Ashfold|David Holland|Daniel Rolles|Basile Curchod,University of Nebraska–Lincoln|SLAC National Accelerator Laboratory|SLAC National Accelerator Laboratory|SLAC National Accelerator Laboratory|SLAC National Accelerator Laboratory|University of Nebraska–Lincoln|Kansas State University|Kansas State University|European X-Ray Free-Electron Laser|SLAC National Accelerator Laboratory|University of Nebraska–Lincoln|University of Nebraska–Lincoln|Kansas State University|Kansas State University|University of Nebraska–Lincoln|UNSW Sydney|SLAC National Accelerator Laboratory|SLAC National Accelerator Laboratory|Université Paris-Saclay|Max-Born-Institute for Nonlinear Optics and Short Pulse Spectroscopy|University of Nebraska–Lincoln|SLAC National Accelerator Laboratory|Brown University|SLAC National Accelerator Laboratory|Deutsches Elektronen-Synchrotron DESY|SLAC National Accelerator Laboratory|Kansas State University|SLAC National Accelerator Laboratory|SLAC National Accelerator Laboratory|University College London|University of Bristol|Daresbury Laboratory|Kansas State University|University of Bristol,Contributor(s) Only,Engineering and Physical Sciences Research Council|United States Department of Energy|National Science Foundation|Australian Research Council|Agence Nationale de la Recherche|European Commission,UED|Trajectories|Ab initio molecular dynamics,Chemical sciences,2023-05-04
Nanopore signal compression benchmark data in BLOW5 format,10.5061/dryad.1vhhmgr3p,246355130196,Hasindu Gamaarachchi,UNSW Sydney,Creator Only,,Nanopore sequencing|Signal compression|Genomics,Computer and information sciences,2024-10-14
Navigating the 16-dimensional Hilbert space of a high-spin donor qudit using magnetic and electric fields,10.5061/dryad.9s4mw6mmf,152912672794,Irene Fernandez De Fuentes,UNSW Sydney,Creator Only,"Department of Industry, Science and Resources|Australian Research Council|United States Army Research Office",Solid state physics|Quantum mechanics|Quantum computing,Physical sciences,2023-07-18
Non-additive genetic effects induce novel phenotypic distributions in male mating traits of F1 hybrids,10.5061/dryad.0k6djhb0f,287557,Keisuke Atsumi|Malgorzata Lagisz|Shinichi Nakagawa,Hokkaido University|UNSW Sydney|UNSW Sydney,Contributor(s) Only,Japan Society for the Promotion of Science|Australian Research Council,,Biological sciences,2021-03-17
Parental breeding age effects on descendants’ longevity interact over two generations in matrilines and patrilines,10.5061/dryad.2rbnzs7hw,497462,Zac Wylde,UNSW Sydney,Creator Only,Australian Research Council,,,2019-11-14
Personality-mediated speed-accuracy tradeoffs in mating in a 17-year periodical cicada,10.5061/dryad.gmsbcc2rf,286845,Allison M. Roth|Sarah M. Kent|Elizabeth A. Hobson|Gene Kritsky|Shinichi Nakagawa,McGill University|Great Parks of Hamilton County|University of Cincinnati|Mount St. Joseph University|UNSW Sydney,Contributor(s) Only,,Magicicada septendecim|Sexual selection|exploration behavior|Pharaoh Cicada|tonic immobility|Same-Sex Sexual Behavior,Biological sciences,2022-08-03
"Plant size, latitude, and phylogeny explain within-population variability in herbivory",10.5061/dryad.44j0zpckm,6028685,William Wetzel|Philip Hahn|Brian Inouye|Nora Underwood|Susan Whitehead|Karen Abbott|Emilio Bruna|N. Ivalu Cacho|Lee Dyer|John Tooker|David Crowder|Bret Elderd|Ronny Groenteman|Micky Eubanks|Quentin Paynter|Andrew McCall|Xoaquín Moreira|Nicolas Lecomte|Enric Frago|Vigdis Vandvik|Mar Sobral|Ian Pearse|Judith Bronstein|Robert Bagchi|Sumanta Bagchi|Katja Poveda|Yuzu Sakata|Rachel Penczykowski|Miika Laihonen|Narayanaswamy Parthasarathy|Lauren Waller|Yamila Sasal|Phoebe Zarnetske|Ikponmwosa EGBON|Heather Kharouba|Javier Puy|Yuval Sapir|Richard Lindroth|Frida I. Piper|Richard Karban|Tania N. Kim|Aino Kalske|Duncan Kimuyu|Zhiwei Zhong|Adam Pepi|Tara Massad|Ayco Tack|Shunsuke Utsumi|Karin Burghardt|Yvonne Buckley|Haruna Ohsaki|Marjorie Weber|Akira Yamawo|Janete Andrade|Diego Angulo|Sarah Barrett|Eyal Ben-Simchon|Kathryn Bloodworth|Jay Rosenheim|Carlos Bustos-Segura|Milton Barbosa|Bastien Castagneyrol|Eduardo Calixto|Bráulio Santos|Warwick Allen|Raquel Carvalho|Daniel Anstett|Luis Abdala-Roberts|Wesley Dáttilo|Matthew Forister|Anu Valtonen|Sergio Rasmann|Sofia Gripenberg|Kévin Tougeron|Tatiana Cornelissen|Diego Anjos|Sally Koerner|Caroline Dallstream|Elizabeth Pringle|Sille Holm|Carina Baskett|Mariana Chiuffo|Geraldo Fernandes|Anjel Helms|Christopher Moore|María-José Endara|Martin Gossner|Filipe França|Angela Moles|Moria Robinson|Cássio Pereira|Elizeth Cinto Mejía|Rodrigo Cogni|Dezirea Cortez|Afure Ejomah|Keiko Farah|Rafael de Paiva Farias|Alain Finn|Grace Florjancic|Quinn Fox|Patrick Grof-Tisza|Nora Haack|Shiekh Marifatul Haq|Justus Hennecke|Liza Holeski|Shinnosuke Kagiya|Monica Kersch-Becker|Kimberly Komatsu|Sushmita Krishnan|Lucas Lamelas-López|Michael LaScaleia|Xiaofei Li|Eric LoPresti|Allison Louthan|Laís Maia|Charlotte Mills|Charlee Ogbebor|Nicholas Pardikes|Leah Rosenheim|Justin Runyon|Cristian Salgado-Luarte|Manasi Sawant|Hayley Schroeder|Hila Segre|David Smith|Daniel Torrico-Bazoberry|Osariyekemwen Uyi|Jessica Vaca-Uribe|Carlos Lehn|Moleseng Moshobane|Marco Ferrante|Andrew Merwin|Vincent Pan|Colin Morrison|Kazuhide Nakajima|Oren Shelef|Michael Eisenring|Christoph Rosche|Michal Segoli|Anne Muola|Jesus Villellas|María Losada|Susan Everingham|Zarluis Mijango-Ramos|Shyam Phartyal|Michael Kalwajtys|Bruce Martin|Julien Davis|Amy Trowbridge|Marina Cock|Sara Hermann|Abigail Getman-Pickering|Carolina Quintero|Victoria Luizzi|Matthew Hutchinson|Olivia Cope|Keri Greig|Nicholas Lyon|Mandeep Tayal|Jennifer Kluse|Naoto Shinohara|Luke Zehr|Akshatra Fernandes|Tamar Keasar|Rohit Pawar|Isabell Schumann|Asaf Sadeh|Laura van Dijk|Samuel Novais|Rachit Pratap Singh|Ben Gooden|Martín Pareja|Danielle Salcido|Ryosuke Nakadai|Samantha Yim|Gisela Stotz|Joshua Lynn|Teresa Quijano|Lisa Hahn|Tosca Mannall|Renata Maia|Damla Cinoğlu|Rupesh Kariyat|Zoe Getman-Pickering|Romina Dimarco|Ernesto Gianoli|Yasuhiro Sato|Haley Dole|Kelsey McGurrin|Eleanor Jackson|Shannon Lynch,"Montana State University|University of Florida|Florida State University|Florida State University|Virginia Tech|Case Western Reserve University|University of Florida|Universidad Nacional Autónoma de México|University of Nevada, Reno|Pennsylvania State University|Washington State University|Louisiana State University|Landcare Research New Zealand|Texas A&M University|Landcare Research New Zealand|Denison University|Misión Biológica de Galicia|Université de Moncton|Centre de Coopération Internationale en Recherche Agronomique pour le Développement|University of Bergen|Universidade de Santiago de Compostela|United States Geological Survey|University of Arizona|University of Connecticut|Indian Institute of Science Bangalore|Cornell University|Akita Prefectural University|Washington University in St. Louis|University of Turku|Pondicherry University|Lincoln University - California|Instituto de Investigaciones en Biodiversidad y Medioambiente|Michigan State University|University of Benin|University of Ottawa|Estación Biológica de Doñana|Tel Aviv University|University of Wisconsin–Madison|University of Talca|University of California, Davis|Kansas State University|University of Turku|Karatina University|Northeast Normal University|University of California, Davis|Gorongosa National Park|Stockholm University|Hokkaido University|University of Maryland, College Park|Trinity College Dublin|Hirosaki University|University of Michigan|Hirosaki University|Universidade Federal da Paraíba|Centro de Investigación Científica de Yucatán|Department of Biodiversity, Conservation and Attractions|Agricultural Research Organization|University of North Carolina at Greensboro|University of California, Davis|University of Neuchâtel|Universidade Federal de Minas Gerais|Institut National de Recherche pour l'Agriculture l'Alimentation et l'Environnement Nouvelle-Aquitaine Bordeaux Centre|University of Florida|Universidade Federal da Paraíba|University of Canterbury|Universidade de São Paulo|Michigan State University|Autonomous University of Yucatán|Instituto de Ecología|University of Nevada, Reno|University of Eastern Finland|University of Neuchâtel|University of Reading|Université de Picardie Jules Verne|Universidade Federal de Minas Gerais|Universidade Federal de Uberlândia|University of North Carolina at Greensboro|McGill University|University of Nevada, Reno|University of Eastern Finland|Institute of Science and Technology Austria|Instituto de Investigaciones en Biodiversidad y Medioambiente|Universidade Federal de Minas Gerais|Texas A&M University|Colby College|Universidad de las Américas|Swiss Federal Institute for Forest, Snow and Landscape Research|University of Bristol|UNSW Sydney|Michigan State University|Universidade Federal de Minas Gerais|Michigan State University|Universidade de São Paulo|California State University, San Bernardino|University of Benin|Washington University in St. Louis|Universidade Federal da Bahia|Trinity College Dublin|Virginia Tech|Washington University in St. Louis|University of Neuchâtel|Independent Institute for Environmental Issues|Wildlife Trust of India, Wildlife Crime Control Division|Leipzig University|Northern Arizona University|Hokkaido University|Pennsylvania State University|University of North Carolina at Greensboro|Amrita Vishwa Vidyapeetham|Universidade dos Açores|University of Connecticut|Jilin Agricultural University|University of South Carolina|Kansas State University|University of Canterbury|UNSW Sydney|Nigerian Institute For Oil Palm Reasearch|Utah State University|University of California, Davis|Rocky Mountain Research Station|University of La Serena|Savitribai Phule Pune University|Cornell University|Agricultural Research Organization|California State University, San Bernardino|Universidad del Desarrollo|University of Benin|Corporación Universitaria Minuto de Dios|Instituto Federal de Educacao Ciencia e Tecnologia Farroupilha - Campus Panambi|South African National Biodiversity Institute|Universidade dos Açores|Baldwin Wallace University|Michigan State University|The University of Texas at Austin|Chuo University|Agricultural Research Organization|Swiss Federal Institute for Forest, Snow and Landscape Research|Martin Luther University Halle-Wittenberg|Ben-Gurion University of the Negev|Norwegian Institute of Bioeconomy Research|Universidad de Alcalá|Universidade de Santiago de Compostela|University of Bern|The University of Texas at Austin|Nalanda University|Michigan State University|Michigan State University|Cornell University|University of Wisconsin–Madison|INCITAP (CONICET-UNLPam)|Pennsylvania State University|,|Instituto de Investigaciones en Biodiversidad y Medioambiente|University of Arizona|University of California, Merced|Whitworth University|The University of Texas at Austin|Michigan State University|Clemson University|Louisiana State University|Tohoku University|Michigan State University|Ganpat Parsekar College of Education Harmal|University of Haifa|Savitribai Phule Pune University|Leipzig University|Agricultural Research Organization|Stockholm University|Instituto de Ecología|University of Florida|Commonwealth Scientific and Industrial Research Organisation|Universidade Estadual de Campinas (UNICAMP)|University of Nevada, Reno|National Institute for Environmental Studies|University of Nevada, Reno|Universidad Andrés Bello|University of Bergen|Autonomous University of Yucatán|Leipzig University|University of Bern|Universidade Federal de Minas Gerais|The University of Texas at Austin|University of Arkansas at Fayetteville|University of Massachusetts Amherst|University of Houston|University of La Serena|University of Zurich|Michigan State University|University of Maryland, College Park|University of Reading|Kansas State University",Contributor(s) Only,Agencia Nacional de Investigación y Desarrollo|University of Pittsburgh|Natural Environment Research Council|Irish Research Council|US Forest Service|São Paulo Research Foundation|Swiss National Science Foundation|Academy of Finland|Centre de Coopération Internationale en Recherche Agronomique pour le Développement|Earthwatch Institute|National Council for Scientific and Technological Development|National University of La Pampa|DFG Priority Program Program 1374*|Instituto de Ecología|United States Department of Agriculture|National Science Foundation of Sri Lanka|National Science Foundation|Japan Society for the Promotion of Science|Fondo Nacional de Desarrollo Científico y Tecnológico|Israel Science Foundation|Agence Nationale de la Recherche,Evolutionary biology|Ecology|Herbivory,Biological sciences,2023-12-18
Plasticity and the adaptive evolution of switchlike reaction norms under environmental change,10.5061/dryad.c2fqz61fj,191830,Claudia Crowther|Stephen Bonser|Lisa Schwanz,Michigan State University|UNSW Sydney|UNSW Sydney,Contributor(s) Only,,temperature-dependent sex determination|Sex ratio|simulation|phenotypic plasticity|Theory,Biological sciences,2023-08-02
Population genetics and invasion history of the European Starling across Aotearoa New Zealand,10.5061/dryad.6djh9w1bd,75358061,Bryan Thompson|Kamolphat Atsawawaranunt|Melissa Nehmens|William Pearman|E Perkins|Pavel Pipek|Lee Rollins|Hui Zhen Tan|Annabel Whibley|Anna Santure|Katarina Stuart,"University of Auckland|University of Auckland|University of Auckland|University of Auckland|University of Auckland|Czech Academy of Sciences, Institute of Botany|UNSW Sydney|University of Auckland|University of Auckland|University of Auckland|University of Auckland",Contributor(s) Only,University of Auckland Summer Research Scholarship|UNSW Scientia scheme|New Zealand Royal Society Te Aparangi Marsden Grant|Czech Academy of Sciences,reduced representation sequencing|population structure |Invasive species|Sturnus vulgaris|historical records|invasion history,Biological sciences,2024-10-22
Population genetics informs the management of a controversial Australian waterbird,10.5061/dryad.wpzgmsbgx,1775850,Skye Davis|Adam Stow|Kate Brandis,Macquarie University|Macquarie University|UNSW Sydney,Contributor(s) Only,Macquarie University|Ecological Society of Australia,,Biological sciences,2021-09-13
Post-release survival and dispersal of translocated crest-tailed mulgara Dasycercus cristicauda,10.5061/dryad.s7h44j19w,55816,Rebecca West,UNSW Sydney,Creator Only,Government of New South Wales,translocation|Dasycercus cristicauda|survival|dispersal,Biological sciences,2022-10-21
Processed data objects for snPATHO-seq paper,10.5061/dryad.7m0cfxq4s,5321867172,Taopeng Wang|Michael Roach|Luciano Martelotto|Alexander Swarbrick,UNSW Sydney|The University of Adelaide|The University of Adelaide|UNSW Sydney,Creator and Contributor(s),La ligue contre le cancer – Comité de l’Ain|Commonwealth Standard Grant Agreement|National Health and Medical Research Council,FFPE|Spatial transcriptomics|single-cell genomics|snRNA-seq|scRNA-seq,Medical and health sciences,2024-10-09
Propagule composition regulates the success of an invasive seaweed across a heterogeneous seascape,10.5061/dryad.44j0zpc8x,83208,Fabio Bulleri|Ezequiel M. Marzinelli|Sofie Voerman|Paul Gribben,University of Pisa|The University of Sydney|UNSW Sydney|UNSW Sydney,Contributor(s) Only,Australian Research Council,Seaweed|Invasion ecology|propagule quality|Coastal ecosystems|Caulerpa taxifolia,,2019-12-01
Proteomic and metabolomic analysis of COVID-19 nasal swabs ,10.5061/dryad.bcc2fqzgp,41711913887,Valerie Wasinger|Sonia Bustamante,UNSW Sydney|UNSW Sydney,Creator and Contributor(s),"Millenium Pharmaceutical Research Grant*|Mark Wainwright Analytical Centre, UNSW*",Cytokines|Tryptophan|COVID-19|SARS CoV 2,Health sciences,2023-02-08
Proteomics and Transcriptomics of the Hippocampus and Cortex in SUDEP and High-Risk SUDEP Patients,10.5061/dryad.dfn2z3508,25460345,Dominique Leitner|James D. Mills|Geoffrey Pires|Arline Faustin|Eleanor Drummond|Evgeny Kanshin|Shruti Nayak|Manor Askenazi|Chloe Verducci|Bei Jun Chen|Michael Janitz|Jasper J. Anink|Johannes C. Baayen|Sander Idema|Erwin A. van Vliet|Sasha Devore|Daniel Friedman|Beate Diehl|Catherine Scott|Roland Thijs|Thomas Wisniewski|Beatrix Ueberheide|Maria Thom|Eleonora Aronica|Orrin Devinsky,NYU Langone Health|Amsterdam University Medical Centers|NYU Langone Health|NYU Langone Health|The University of Sydney|NYU Langone Health|NYU Langone Health|Biomedical Hosting LLC|NYU Langone Health|UNSW Sydney|UNSW Sydney|Amsterdam University Medical Centers|Amsterdam University Medical Centers|Amsterdam University Medical Centers|Amsterdam University Medical Centers|NYU Langone Health|NYU Langone Health|University College London|University College London|Stichting Epilepsie Instellingen Nederland|NYU Langone Health|NYU Langone Health|University College London|Stichting Epilepsie Instellingen Nederland|NYU Langone Health,Contributor(s) Only,,,,2021-07-05
Resilience of seagrass populations to thermal stress does not reflect regional differences in ocean climate,10.5061/dryad.gb5mkkwq2,1571318,Scott Bennett|Teresa Alcovero|Demetris Kletou|Charalampos Antoniou|Jordi Boada|Xavier Buñuel|Lidia Cucala|Gabriel Jorda|Periklis Kleitou|Guillem Roca|Julia Santana-Garcon|Ioannis Savva|Adriana Verges|Nuria Marba,University of Tasmania|Centre d'Estudis Avançats de Blanes|Marine & Environmental Research Lab Ltd|Marine & Environmental Research Lab Ltd|Centre d'Estudis Avançats de Blanes|Centre d'Estudis Avançats de Blanes|Mediterranean Institute for Advanced Studies|Instituto Español de Oceanografía|Marine & Environmental Research Lab Ltd|Mediterranean Institute for Advanced Studies|Mediterranean Institute for Advanced Studies|Marine & Environmental Research Lab Ltd|UNSW Sydney|Mediterranean Institute for Advanced Studies,Contributor(s) Only,Australian Research Council|European Commission|Fundación BBVA,Anthropogenic climate change|Thermal sensitivity|Climate change|Local adapation,,2022-01-31
