title,doi,storage_size,authors,affiliations,author_order,funders,keywords,fieldOfScience,publication_date
Data from: Coral settlement on a highly disturbed equatorial reef system,10.5061/dryad.g70nj,170284,Andrew G. Bauman|James R. Guest|Glenn Dunshea|Jeffery Low|Peter A. Todd|Peter D. Steinberg,"Nanyang Technological University|Nanyang Technological University|Ecological Marine Services, Burnett Heads, Queensland, Australia|National Parks Board|National University of Singapore|Nanyang Technological University",Unknown,,Poritidae|Pocilloporidae|Acroporidae|Coral settlement,,2016-04-27
Data from: Correlational selection does not explain the evolution of a behavioural syndrome,10.5061/dryad.624gb,69686,Chang S. Han|Robert C. Brooks,UNSW Sydney|UNSW Sydney,Creator and Contributor(s),,correlational selection|selection analysis|behavioural syndrome|Tenagogerris euphrosyne,,2013-07-09
Data from: Could adult or juvenile dispersal shape geographical parthenogenesis? Evidence from the facultatively parthenogenetic phasmid Megacrania batesii,10.5061/dryad.zkh1893jv,338843,Jigmidmaa Boldbaatar|Nathan Burke|Ana Vasconcelos|Russell Bonduriansky,UNSW Sydney|Universität Hamburg|UNSW Sydney|UNSW Sydney,Creator and Contributor(s),Australian Research Council,facultative parthenogenesis|geographical parthenogenesis|dispersal,Biological sciences,2025-05-14
"Data from: Covariation in life-history traits: differential effects of diet on condition, hormones, behavior and reproduction in genetic finch morphs",10.5061/dryad.v3b42mv1,359055,Sarah R. Pryke|Lee B. Astheimer|Simon C. Griffith|William A. Buttemer,Australian National University|Deakin University|Macquarie University|Deakin University,Unknown,,Life history: evolution|Behavior: reproductive|polymorphism|Physiology: reproductive|Life history: endocrine|Evolution: physiological|Erythrura gouldiae,,2011-10-26
Data from: Cross-cultural variation in men’s preference for sexual dimorphism in women’s faces,10.5061/dryad.32610,243280,Mikhail V. Kozlov|Huajian Cai|Jorge Contreras-Garduño|Barnaby J. Dixson|Gavita A. Oana|Gwenaël Kaminski|Norman P. Li|Minna T. Lyons|Ike E. Onyishi|Keshav Prasai|Farid Pazhoohi|Pavol Prokop|Sandra L. Rosales Cardozo|Nicolle Sydney|Jose C. Yong|Markus J. Rantala|U. M. Marcinkowska|J. Contreras-Garduno,"University of Turku|Chinese Academy of Sciences|Universidad de Guanajuato|UNSW Sydney|Babeș-Bolyai University|Université de Toulouse|Singapore Management University|University of Liverpool|University of Nigeria|Model College, Kathmandu, Nepal|Shiraz University|University of Trnava|Universidad de Ibagué|Universidade Federal do Paraná|Singapore Management University|University of Turku|University of Turku|Universidad de Guanajuato",Contributor(s) Only,,facial preferences|femininity|national health|other-race effect,,2014-04-10
"Data from: Cross-validation strategies for data with temporal, spatial, hierarchical, or phylogenetic structure",10.5061/dryad.737gk,10654261,David R. Roberts|Volker Bahn|Simone Ciuti|Mark S. Boyce|Jane Elith|Gurutzeta Guillera-Arroita|Severin Hauenstein|José J. Lahoz-Monfort|Boris Schröder|Wilfried Thuiller|David I. Warton|Brendan A. Wintle|Florian Hartig|Carsten F. Dormann,University of Freiburg|Wright State University|University of Freiburg|University of Alberta|The University of Melbourne|The University of Melbourne|University of Freiburg|The University of Melbourne|University of Freiburg|The University of Melbourne|UNSW Sydney|The University of Melbourne|University of Freiburg|University of Freiburg,Contributor(s) Only,,overfit|Extrapolation|Autocorrelation,,2016-12-08
Data from: Cultural transmission of tool use combined with habitat specializations leads to fine-scale genetic structure in bottlenose dolphins,10.5061/dryad.k5b1j,135527,Anna M. Kopps|Corinne Y. Ackermann|William B. Sherwin|Simon J. Allen|Lars Bejder|Michael Krützen|M. Krutzen,UNSW Sydney|University of Zurich|UNSW Sydney|Murdoch University|Murdoch University|UNSW Sydney|UNSW Sydney,Creator and Contributor(s),,sponging|Tursips sp.|mtDNA haplotyes|cultural hitchhiking,,2015-03-03
Data from: Death by sex in an Australian icon: a continent-wide survey reveals extensive hybridization between dingoes and domestic dogs,10.5061/dryad.2rd32,2139162,Danielle Stephens|Alan N. Wilton|Peter J. S. Fleming|Oliver Berry|Peter J.S. Fleming,The University of Western Australia|UNSW Sydney|The University of Western Australia|The University of Western Australia|University of New England,Contributor(s) Only,,Canis familiarus dingo|dingo|Anthropocene|wild dog|Canis familiarus,,2015-10-08
"Data from: Defining the pyro-thermal niche: do seed traits, ecosystem type and phylogeny influence thermal thresholds in seeds with physical dormancy",10.5061/dryad.j9kd51cm3,131012,Ryan Tangney|Sarah McInnes|Emma Dalziell|William Cornwell|Ben Miller|Tony Auld|Mark Ooi,"Department of Biodiversity, Conservation and Attractions|UNSW Sydney|Department of Biodiversity, Conservation and Attractions|UNSW Sydney|Department of Biodiversity, Conservation and Attractions|UNSW Sydney|UNSW Sydney",Contributor(s) Only,Australian Research Council,Seed Survival|post-fire germination|physical dormancy|seed dormancy|pyro-thermal niche,Earth and related environmental sciences,2025-02-28
Data from: Dendrogramma is a siphonophore,10.5061/dryad.7qs68,7716110,Timothy D. O'Hara|Andrew F. Hugall|Hugh MacIntosh|Kate M. Naughton|Alan Williams|Adnan Moussalli,The University of Melbourne|The University of Melbourne|The University of Melbourne|The University of Melbourne|UNSW Sydney|The University of Melbourne,Contributor(s) Only,,cormidial bract|Cnidaria|phylogenomic|Dendrogramma|benthic siphonophore|Not applicable|Physonectae|Siphonophora,,2017-03-21
Data from: Detection of persistent signals and its relation to coherent feedforward loops,10.5061/dryad.20md774,38249,Chun Tung Chou,UNSW Sydney,Creator Only,,Detection theory|Systems biology|Molecular computation|Time-scale separation,,2018-10-09
Data from: Developing state and transition models of floodplain vegetation dynamics as a tool for conservation decision-making: a case study of the Macquarie Marshes Ramsar wetland,10.5061/dryad.b022b,25552,Gilad Bino|Scott A. Sisson|Richard T. Kingsford|Rachael F. Thomas|Sharon Bowen,UNSW Sydney|UNSW Sydney|UNSW Sydney|UNSW Sydney|NSW Office of Environment & Heritage,Creator and Contributor(s),,1991-2008|conservation management|ecological thresholds|Bayesian statistics|conservation decision-making|river regulation|inundation,,2016-02-03
Data from: Development time mediates the effect of larval diet on ageing and mating success of male antler flies in the wild,10.5061/dryad.2rbnzs7jj,1180875,Christopher Angell|Mathieu Oudin|Nicolas Rode|Brian Mautz|Russell Bonduriansky|Howard Rundle,University of Ottawa|University of Ottawa|University of Ottawa|University of Ottawa|UNSW Sydney|University of Ottawa,Contributor(s) Only,CeMEB LabEx/University of Montpellier|Australian Research Council|Natural Sciences and Engineering Research Council|CeMEB LabEx/University of Montpellier*,mating rate|actuarial senescence|life history trade-off|Development time|Protopiophila litigata|silver spoon,,2020-11-05
Data from: Developmental diet irreversibly shapes male post-copulatory traits in the neriid fly (Telostylinus angusticollis),10.5061/dryad.0215pq7,38389,Erin L. Macartney|Philip R. Nicovich|Russell Bonduriansky|Angela J. Crean,UNSW Sydney|Allen Institute for Brain Science|UNSW Sydney|The University of Sydney,Creator and Contributor(s),,Dietary restriction|Telostylinus angusticollis|Sperm|condition-dependence|post-copulatory,,2018-09-27
Data from: Diagnostic yield in epileptic encephalopathies is improved by genome sequencing and re-analysis,10.5061/dryad.s1rn8pk67,6644655,Elizabeth Palmer,UNSW Sydney,Creator Only,,,Clinical medicine,2022-01-15
Data from: Diet adaptation in dog reflects spread of prehistoric agriculture,10.5061/dryad.1j6b6,164577,Maja Arendt|Kylie M. Cairnes|J.W.O. Ballard|Peter Savolainen|Erik Axelsson,Science for Life Laboratory|UNSW Sydney|UNSW Sydney|Science for Life Laboratory|Science for Life Laboratory,Contributor(s) Only,,Starch digestion|dog domestication|Canis latrans|Canis lupus|Neolithic|Canis aureus|Palaeolithic,,2016-05-31
Data from: Dietary responses of Sahul (Pleistocene Australia–New Guinea) megafauna to climate and environmental change,10.5061/dryad.1s3d4,966100,Larisa R.G. DeSantis|Judith H. Field|Stephen Wroe|John R. Dodson,Vanderbilt University|UNSW Sydney|UNSW Sydney|UNSW Sydney,Contributor(s) Only,National Science Foundation,Phascolonus|diprotodontids|dietary ecology|Diprotodontidae|Macropodidae|dental microwear|Zygomaturus|Quaternary|Sthenurus|Palorchestes|wombats|Vombatidae|Protemnodon|Kangaroos|Paleontology|Macropus|Vombatus|DMTA|megafauna,,2016-11-02
Data from: Dietary restriction fails to extend life in stressful environments,10.5061/dryad.rv15dv4d3,445827,Felix Zajitschek|Susanne Zajitschek|Ana Vasconcelos|Russell Bonduriansky,UNSW Sydney|Liverpool John Moores University|UNSW Sydney|UNSW Sydney,Creator and Contributor(s),Australian Research Council,parental effects|Temperature|reproduction|Diet|survival|stress|Drosophila melanogaster|sex difference,Biological sciences,2023-06-09
Data from: Differentiating founder and chronic HIV envelope sequences,10.5061/dryad.r19c2,310228,John M. Murray|Stephen Maher|Talia Mota|Kazuo Suzuki|Anthony D. Kelleher|Rob J. Center|Damian Purcell,UNSW Sydney|UNSW Sydney|The University of Melbourne|UNSW Sydney|UNSW Sydney|The University of Melbourne|The University of Melbourne,Creator and Contributor(s),,Operations research|envelope sequences,,2018-01-30
Data from: Digging deeper: habitat selection within the home ranges of a threatened marsupial,10.5061/dryad.s1rn8pk9w,1019379,Kate Cornelsen|Andrew Elphinstone|Neil Jordan,UNSW Sydney|Taronga Conservation Society Australia|UNSW Sydney,Creator and Contributor(s),"Centre for Ecosystem Science, University of New South Wales|Wildlife Preservation Society of Australia|Taronga Conservation Society Australia",wildlife tracking|habitat selection|GPS|wildlife conservation|greater bilby|resource selection function|animal-habitat relationships,Biological sciences,2024-04-14
Data from: Do changes in grazing pressure and the degree of shrub encroachment alter the effects of individual shrubs on understorey plant communities and soil function?,10.5061/dryad.gg3c9,79143,Santiago Soliveres|David J. Eldridge,Universidad Rey Juan Carlos|UNSW Sydney,Contributor(s) Only,,semiarid|open woodland|landscape functional analysis|shrub encroachment,,2013-10-01
Data from: Do grazing intensity and herbivore type affect soil health? Insights from a semi-arid productivity gradient,10.5061/dryad.k3p8n,109780,David J. Eldridge|Manuel Delgado-Baquerizo|Samantha K. Travers|James Val|Ian Oliver|David Eldridge,UNSW Sydney|Western Sydney University|UNSW Sydney|NSW Office of Environment & Heritage|University of New England|University of New England,Creator and Contributor(s),,kangaroo|Healthy soils|Herbivore activity|Soil condition,,2017-09-12
Data from: Does size matter? Examining the drivers of mammalian vocalisations,10.5061/dryad.289kh,67947,Kobe Martin|Marlee A. Tucker|Tracey L. Rogers,UNSW Sydney|Goethe University Frankfurt|UNSW Sydney,Creator and Contributor(s),,Signaling/Courtship|Mammalia,,2016-11-17
Data from: Does wildlife resource selection accurately inform corridor conservation?,10.5061/dryad.66kc7,2121286,Briana Abrahms|Sarah C. Sawyer|Neil R. Jordan|J. Weldon McNutt|Alan M. Wilson|Justin S. Brashares,"University of California, Berkeley|United States Department of Agriculture|UNSW Sydney|University of California, Berkeley|University of London|University of California, Berkeley",Contributor(s) Only,,landscape connectivity|step selection|Lycaon pictus|resource selection|landscape resistance|conservation planning|corridor ecology|behavioural state,,2017-05-25
Data from: Drought-induced relocation of ant colonies and its consequences for the long-term spatial ecology of a population under stress,10.5061/dryad.n8pk0p31n,114018,Terry Ord,UNSW Sydney,Creator Only,UNSW Sydney,Meat ants|resilience to drought|annual rainfall|ant|drought stress|bet hedging|Iridomyrmex purpureus|competitive exclusion|colony network|dispersal limitation,Biological sciences,2023-05-24
"Data from: Dunnock social status correlates with sperm speed, but fast sperm does not always equal high fitness",10.5061/dryad.ncjsxksrh,873909,Carlos E. Lara|Helen R. Taylor|Benedikt Holtmann|Eduardo S. A. Santos|Sheri L. Johnson|Neil J. Gemmell|Shinichi Nakagawa,University of Otago|Royal Zoological Society of Scotland|Ludwig-Maximilians-Universität München|Universidade de São Paulo|University of Otago|University of Otago|UNSW Sydney,Contributor(s) Only,Minciencias Colombia*|Rutherford Discovery Fellowship|Minciencias Colombia|Rutherford Discovery Fellowship *,Mating Systems|intra‐class correlation coefficient|post‐sexual selection,,2020-06-11
Data from: Dynamics of pre-choice and post-choice behaviour: rats approximate optimal strategy in a discrete-trial decision task,10.5061/dryad.j55sn,3313897,Justine Fam|Reginald Fred Westbrook|Ehsan Arabzadeh|F. Westbrook,UNSW Sydney|Australian National University|Australian National University|UNSW Sydney,Creator and Contributor(s),,optimal foraging|discrete-trial|matching,,2015-01-28
Data from: Ecological effects of habitat complexity vary with intertidal elevation: Implications for seawall eco-engineering,10.5061/dryad.9p8cz8wtr,605758,Maria Vozzo|Melanie Bishop|Katherine Dafforn|Mariana Mayer Pinto,CSIRO|Macquarie University|Macquarie University|UNSW Sydney,Contributor(s) Only,Volvo Cars Australia|North Sydney Council,Temperature|ocean sprawl|Biodiversity|marine construction|benthic|eco-engineering|urbanisation|nature inclusive design|Functional groups|microhabitat,Biological sciences,2025-04-22
Data from: Effects of condition and sperm competition risk on sperm allocation and storage in neriid flies,10.5061/dryad.hhmgqnkc6,69844,Zac Wylde|Angela Crean|Russell Bonduriansky,UNSW Sydney|The University of Sydney|UNSW Sydney,Creator and Contributor(s),Australian Research Council,larval diet|ejaculate|rhodamine|condition-dependence,,2019-09-26
Data from: Elucidating biogeographical patterns in Australian native canids using genome wide SNPs,10.5061/dryad.sq8d0,7786863,Kylie M. Cairns|Laura M. Shannon|Janice Koler-Matznick|J. William O. Ballard|Adam R. Boyko,"UNSW Sydney|Cornell University|The New Guinea Singing Dog Conservation Society, Central Point, Oregon, United States of America|UNSW Sydney|Cornell University",Creator and Contributor(s),,dingo|Canis dingo|Inbreeding,,2019-05-29
Data from: Environmental and local habitat variables as predictors of trophic interactions in subtidal rocky reefs along the SE Pacific coast,10.5061/dryad.hqbzkh1q8,1272005,Catalina Musrri Fuenzalida|Alistair Poore|Oscar Pino|Nicolas Riquelme|Wolfgang Stotz|Fadia Tala|Martin Thiel,The University of Sydney|UNSW Sydney|Universidad Católica del Norte|Universidad Católica del Norte|Universidad Católica del Norte|Universidad Católica del Norte|Smithsonian Environmental Research Center,Contributor(s) Only,Agencia Nacional de Investigación y Desarrollo,Dissolved oxygen|Trophic interactions|Habitats|community|Ocean temperature|latitudinal gradients,Biological sciences,2025-04-23
Data from: Evidence that fertility trades off with early offspring fitness as males age,10.5061/dryad.cj5q8,90806,Sheri L. Johnson|Sylvia Zellhuber-McMillan|Joanne Gillum|Jessica Dunleavy|Jonathan P. Evans|Shinichi Nakagawa|Neil J. Gemmell,University of Otago|University of Otago|University of Otago|University of Otago|The University of Western Australia|UNSW Sydney|University of Otago,Contributor(s) Only,,sperm quality|Danio rerio,,2017-12-22
Data from: Evidence that hepatitis C virus genome partly controls infection outcome,10.5061/dryad.3978f,30998,Matthew Hartfield|Rowena Bull|Peter A. White|Andrew Lloyd|Fabio Luciani|Samuel Alizon,"UNSW Sydney|UNSW Sydney|UNSW Sydney|UNSW Sydney|UNSW Sydney|Maladies Infectieuses et Vecteurs: Écologie, Génétique, Évolution et Contrôle",Creator and Contributor(s),,Disease Biology|Flaviviridae|Evolutionary Medicine|Host Parasite Interactions|Biomedicine|Hepacivirus|Bioinfomatics/Phyloinfomatics,,2013-11-05
"Data from: Evolution of defence and herbivory in introduced plants - testing enemy release using a known source population, herbivore trials and time since introduction",10.5061/dryad.ksn02v716,213870,Claire Brandenburger|Martin Kim|Eve Slavich|Floret Meredith|Juha-Pekka Salminen|William Sherwin|Angela Moles,UNSW Sydney|UNSW Sydney|UNSW Sydney|UNSW Sydney|University of Turku|UNSW Sydney|UNSW Sydney,Creator and Contributor(s),Australian Research Council,leaf alkaloids|Arctotheca populifolia|introduced plants|Rapid evolution|time since introduction|leaf toughness|leaf ash|Herbivore preference|enemy release|Leaf traits|leaf phenolics|herbarium specimens|source population|leaf hairs|leaf damage|leaf carbon to nitrogen ratio,,2021-04-09
Data from: Evolutionary loss of complexity in animal signals: cause and consequence,10.5061/dryad.8gtht76sz,70126,Terry Ord,UNSW Sydney,Creator Only,UNSW Sydney,colour signal|environmental noise|animal signals|evolutionary loss|ornament|energetic cost,Biological sciences,2022-12-05
Data from: Exoskeleton ageing and its relation to longevity and fecundity in female Australian Leaf Insects (Phyllium monteithi),10.5061/dryad.sqv9s4n5x,182902,Russell Bonduriansky|Caitlin Creak,UNSW Sydney|UNSW Sydney,Creator and Contributor(s),Australian Research Council,,Biological sciences,2022-03-31
Data from: Experimental evidence for phonemic contrasts in a nonhuman vocal system,10.5061/dryad.082v2,90766,Sabrina Engesser|Jodie M. S. Crane|James L. Savage|Andrew F. Russell|Simon W. Townsend,University of Zurich|University of Sheffield|University of Cambridge|University of Exeter|University of Zurich,Unknown,,Language|phoneme structure|vocal communication|chestnut-crowned babbler|Phonology|Pomatostomus ruficeps|combinatorial,,2016-06-11
"Data from: Experimental evidence of condition-dependent sexual dimorphism in the weakly dimorphic antler fly, Protopiophila litigata (Diptera: Piophilidae)",10.5061/dryad.h3690,37214,Mathieu J. Oudin|Russell Bonduriansky|Howard D. Rundle,University of Ottawa|UNSW Sydney|University of Ottawa,Contributor(s) Only,,aedeagus|Protopiophila litigata,,2015-03-10
Data from: Expression of eukaryotic-like protein in the microbiome of sponges,10.5061/dryad.7717q,335358569,Cristina Díez-Vives|Lucas Moitinho-Silva|Shaun Nielsen|David Reynolds|Torsten Thomas,UNSW Sydney|UNSW Sydney|UNSW Sydney|UNSW Sydney|UNSW Sydney,Creator and Contributor(s),,symbiont|metatranscriptomics|Host interactions|Sponges|ELP,,2016-12-29
Data from: Extinction of South American sparassodontans (Metatheria): environmental fluctuations or complex ecological processes?,10.5061/dryad.165tm,1679873,Camilo López-Aguirre|Michael Archer|Suzanne J. Hand|Shawn W. Laffan,UNSW Sydney|UNSW Sydney|UNSW Sydney|UNSW Sydney,Creator and Contributor(s),,apex predator|competitive displacement|South American mammals|GABI|Caviomorpha|Xenungulata|Didelphimorphia|Primates|Sparassodonta,,2017-10-20
Data from: Extreme fire severity interacts with seed traits to moderate post-fire species assemblages,10.5061/dryad.9ghx3ffqq,209191,Michi Sano|Ryan Tangney|Alexandria Thomsen|Mark Ooi,UNSW Sydney|Kings Park Science|UNSW Sydney|UNSW Sydney,Creator and Contributor(s),Australian Research Council,Seed mass|Climate change|fire|fire severity|Post-fire Recruitment|seed dormancy|Seed traits|Ecology,Earth and related environmental sciences,2025-03-17
Data from: Factors leading to the evolution and maintenance of a male ornament in territorial species,10.5061/dryad.fg0kq00m,30463,Grace K. Charles|Terry J. Ord,Harvard University|UNSW Sydney,Contributor(s) Only,,Anolis|present day|visual signal|Exaptation|phylogenetic comparative method|Caribbean anoles|Ancestor state reconstruction,,2011-11-14
Data from: Faster than expected: Release of nitrogen and phosphorus from decomposing woody litter,10.5061/dryad.w9ghx3g0g,166815,Baptiste Wijas|Will Cornwell|Brad Oberle|Amy Zanne,Cary Institute of Ecosystem Studies|UNSW Sydney|New York Botanical Garden|Cary Institute of Ecosystem Studies,Contributor(s) Only,Australian Research Council|U.S. National Science Foundation,Microbes|deadwood|Decomposition|Nutrient cycle|Temperate forests|Stoichiometry,Biological sciences,2024-12-06
Data from: Female preference for multi-modal courtship: multiple signals are important for male mating success in peacock spiders,10.5061/dryad.9gr00,45637,Madeline B. Girard|Damian O. Elias|Michael M. Kasumovic,"University of California, Berkeley|University of California, Berkeley|UNSW Sydney",Contributor(s) Only,,peacock spider|Animal communication|multiple-messages hypothesis|Female preference|Maratus volans|multi-modal signals|redundant signal hypothesis,,2015-11-24
Data from: female preference for super-sized male ornaments and its implications for the evolution of ornament allometry,10.5061/dryad.0gb5mkm3q,86061,Terry Ord|Thomas Summers,UNSW Sydney|UNSW Sydney,Creator and Contributor(s),Australian Research Council,Mate choice|visual signal|ornament size|Alticus|blenny|super-normal stimulus,Biological sciences,2022-05-12
Data from: Fern and lycophyte diversity in the Pacific Northwest: patterns and predictors,10.5061/dryad.bb85640,726611,Melanie A. Link-Perez|Shawn W. Laffan,Oregon State University|UNSW Sydney,Contributor(s) Only,,paleo-endemism|neo-endemism|spatial phylogenetics|CANAPE|Holocene|Phylogenetic endemism|lycophyte|Fern,,2018-06-01
Data from: Fluorescent protein-mediated colour polymorphism in reef corals: multi-copy genes extend the adaptation/acclimatization potential to variable light environments,10.5061/dryad.5d079,550588,John R. Gittins|Cecilia D'Angelo|Franz Oswald|Richard Edwards|Joerg Wiedenmann|Richard J. Edwards,University of Southampton|University of Southampton|Department of Internal Medicine I; University Medical Center Ulm; 89081 Ulm Germany|University of Southampton|University of Southampton|University of Southampton,Unknown,,Cnidarians|Gene Structure and Function,,2014-12-11
Data from: From ratites to rats: the size of fleshy fruits shapes species' distributions and continental rainforest assembly,10.5061/dryad.rm5dr,24183240,Maurizio Rossetto|Jia-Yee S. Yap|Robert Kooyman|Shawn Laffan,"National Herbarium of NSW, The Royal Botanic Gardens and Domain Trust, Mrs Macquaries Road, Sydney, New South Wales 2000, Australia|National Herbarium of NSW, The Royal Botanic Gardens and Domain Trust, Mrs Macquaries Road, Sydney, New South Wales 2000, Australia|National Herbarium of NSW, The Royal Botanic Gardens and Domain Trust, Mrs Macquaries Road, Sydney, New South Wales 2000, Australia|UNSW Sydney",Contributor(s) Only,,fruit size|Next Generation Sequencing|Rainforest assembly,,2015-11-18
Data from: Functional extinction of a desert rodent: implications for seed fate and vegetation dynamics,10.5061/dryad.p45p4,53198,Christopher E. Gordon|Mike Letnic,Western Sydney University|UNSW Sydney,Contributor(s) Only,,Rodent|Functional Extinction|granivore|Notomys fuscus,,2015-10-08
Data from: Functional heterogeneity within the rodent lateral orbitofrontal cortex dissociates outcome devaluation and reversal learning deficits,10.5061/dryad.c3b0260,50609,Marios C Panayi|Simon Killcross,University of Oxford|UNSW Sydney,Contributor(s) Only,,,,2019-07-26
Data from: Future climate change is predicted to affect the microbiome and condition of habitat-forming kelp,10.5061/dryad.p8br3r4,9876101678,Zhiguang Qiu|Melinda A Coleman|Euan Provost|Alexandra H Campbell|Brendan P Kelaher|Steven J Dalton|Torsten Thomas|Peter D Steinberg|Ezequiel M Marzinelli,"UNSW Sydney|Department of Primary Industries, Parks, Water and Environment|Southern Cross University|UNSW Sydney|Southern Cross University|Southern Cross University|UNSW Sydney|UNSW Sydney|UNSW Sydney",Creator and Contributor(s),,acidification|disease|holobiont|Ecklonia radiata,,2019-04-08
Data from: Gendered disparities in quality of cataract surgery in a marginalised population in Pakistan: the Karachi marine fishing communities eye and general health survey,10.5061/dryad.7q5c7,31878,Khabir Ahmad|Anthony B. Zwi|Daniel J. M. Tarantola|Abdul Qadeem Soomro|Rashid Baig|Syed Iqbal Azam,UNSW Sydney|UNSW Sydney|UNSW Sydney|Institute of Ophthalmology|Aga Khan University|Aga Khan University,Creator and Contributor(s),,Khabir Ahmad|gender|Cataract surgery|Disparities|quality|Cataract|Vision impairment|Blindness,,2016-06-16
"Data from: Genetic isolation between coastal and fishery-impacted, offshore bottlenose dolphin (Tursiops spp.) populations",10.5061/dryad.908g4,176811,Simon J. Allen|Kate A. Bryant|Robert H. S. Kraus|Neil R. Loneragan|Anna M. Kopps|Alexander M. Brown|Livia Gerber|Michael Krützen,The University of Western Australia|Murdoch University|University of Konstanz|Murdoch University|University of Zurich|Murdoch University|University of Zurich|University of Zurich,Unknown,,Wildlife Management|Tursiops spp.|>2000|Tursiops spp|L. hosei,,2016-03-24
Data from: Genetic rescue increases fitness and aids rapid recovery of an endangered marsupial population,10.5061/dryad.7g988,171621,Andrew R. Weeks|Dean Heinze|Louise Perrin|Jakub Stoklosa|Ary A. Hoffmann|Anthony van Rooyen|Tom Kelly|Ian Mansergh,"The University of Melbourne|La Trobe University|Mt Buller Mt Stirling Resort Management, Mt Buller, Australia|UNSW Sydney|The University of Melbourne|cesar Pty Ltd, Parkville, Australia|cesar Pty Ltd, Parkville, Australia|La Trobe University",Contributor(s) Only,,Burramys parvus|genetic rescue,,2017-10-20
