title,doi,storage_size,authors,affiliations,author_order,funders,keywords,fieldOfScience,publication_date
2D and 3D biometrics fingerprint dataset in contacless and labeled conditions,10.5061/dryad.612jm649q,16476699746,Jiankun Hu|Wei Zhou,University of New South Wales Canberra at ADFA|UNSW Sydney,Creator and Contributor(s),UNSW Sydney,3D fingerprint dataset|Biometrics|dataset|2D fingerprint dataset|fingerprint,Computer and information sciences,2023-12-26
A dominant-negative SOX18 mutant disrupts multiple regulatory layers essential to transcription factor activity,10.5061/dryad.h9w0vt4gn,2293822253,Jieqiong Lou|Alex McCann|Mehdi Moustaqil|Matthew Graus|Ailisa Blum|Frank Fontaine|Hui Liu|Winnie Luu|Peter Koopman|Emma Sierecki|Yann Gambin|Frédéric Meunier|Zhe Liu|Elizabeth Hinde|Mathias Francois,The University of Melbourne|The University of Queensland|UNSW Sydney|The University of Sydney|The University of Queensland|The University of Queensland|Howard Hughes Medical Institute|The University of Sydney|The University of Queensland|UNSW Sydney|UNSW Sydney|The University of Queensland|Howard Hughes Medical Institute|The University of Melbourne|The University of Queensland,Contributor(s) Only,Australian Research Council|Jacob Haimson Beverly Mecklenburg Lectureship*|National Health and Medical Research Council,"Molecular Cell Biology, Biophysics, fluorescence correlation spectroscopy",,2021-10-15
A human working memory advantage for social network information,10.5061/dryad.h44j0zprc,613153,Jack Andrews|Karina Grunewald|Susanne Schweizer,UNSW Sydney|UNSW Sydney|UNSW Sydney,Creator and Contributor(s),Wellcome Trust,Depression|Working memory|Social networks,Psychology,2024-10-29
Abiotic factors that prompt major ecological transitions: are fish on land to escape an intolerable aquatic environment?,10.5061/dryad.ht76hdrrd,136506,Terry Ord|Elizabeth Surovic|Diego Vaz|Iker Irisarri,UNSW Sydney|UNSW Sydney|University of Guam|Leibniz Institute for the Analysis of Biodiversity Change,Creator and Contributor(s),UNSW Sydney|Leibniz Institute for the Analysis of Biodiversity Change,Respiration|thermoregulation|adaptive speciation|Intertidal|Physiology|Biological invasion|Tidepool,Biological sciences,2024-09-25
ACCESS model outputs for FW simulations under PI and LIG boundary conditions,10.5061/dryad.5qfttdzfw,329385587,Himadri Saini|Gabriel M. Pontes|Josephine R. Brown|Russell Drysdale|Yanxuan Du|Menviel Laurie,UNSW Sydney|UNSW Sydney|The University of Melbourne|The University of Melbourne|The University of Melbourne|UNSW Sydney,Creator and Contributor(s),Australian Research Council,Australian hydroclimate|AMOC shutdwon|Last Interglacial,Physical sciences,2025-01-28
Adaptively integrated sequencing and assembly of near-complete genomes,10.5061/dryad.kkwh70sfr,39223359997,Hasindu Gamaarachchi|Igor Stevanovski|Jillian M. Hammond|Andre L.M. Reis|Melissa Rapadas|Kavindu Jayasooriya|Tonia Russell|Dennis Yeow|Yvonne Hort|Andrew J. Mallett|Elaine Stackpoole|Lauren Roman|Luke W. Silver|Carolyn J. Hogg|Lou Streeting|Ozren Bogdanovic|Renata Rodrigues|Luis Nascimento|Adauto Lima Cardoso|Arthur Georges|Haoyu Cheng|Hardip R. Patel|Kishore R. Kumar|Amali C. Mallawaarachchi|Ira W. Deveson,UNSW Sydney|Garvan Institute of Medical Research|Garvan Institute of Medical Research|Garvan Institute of Medical Research|Garvan Institute of Medical Research|UNSW Sydney|Garvan Institute of Medical Research|Garvan Institute of Medical Research|Garvan Institute of Medical Research|James Cook University|King Edward Memorial Hospital|University of Tasmania|The University of Sydney|The University of Sydney|University of New England|UNSW Sydney|Universidade Federal do Pará|Universidade Federal do Pará|Universidade Estadual Paulista (Unesp)|University of Canberra|Yale School of Medicine|Australian National University|Garvan Institute of Medical Research|Garvan Institute of Medical Research|Garvan Institute of Medical Research,Creator and Contributor(s),,Nanopore sequencing|Sequence assembly tools|Genome sequencing|hg002,Biological sciences,2025-07-16
Affiliation history and age similarity predict alliance formation in adult male bottlenose dolphins,10.5061/dryad.3n5tb2rcd,154088,Livia Gerber|Richard Connor|Stephanie King|Simon Allen|Samuel Wittwer|Manuela Bizzozzero|Whitney Friedman|Stephanie Kalberer|William Sherwin|Sonja Wild|Erik Willems|Michael Kruetzen,"University of Zurich|University of Massachusetts Dartmouth|University of Bristol|University of Bristol|University of Zurich|University of Zurich|University of California, Santa Barbara|Frankfurt Zoological Society|UNSW Sydney|University of Konstanz|University of Zurich|University of Zurich",Contributor(s) Only,,social bonds|bottlenose dolphins|male alliance|multi-level society,,2019-11-05
African wild dog access to kills,10.5061/dryad.xgxd254g7,2904443,Neil Jordan|Krystyna Golabek|Dominik Behr|Reena Walker|Laura Plimpton|Samantha Lostrom|Megan Claase|Leanne Van der Weyde|J. Weldon McNutt,UNSW Sydney|Botswana Predator Conservation Trust|University of Zurich|Botswana Predator Conservation Trust|Botswana Predator Conservation Trust|Botswana Predator Conservation Trust|Stellenbosch University|UNSW Sydney|Botswana Predator Conservation Trust,Creator and Contributor(s),,,,2021-12-23
Alzheimer’s disease: Ablating single master site abolishes tau hyperphosphorylation,10.5061/dryad.bvq83bkc0,154505,Kristie Stefanoska|Arne Ittner|Mehul Gajwani|Amanda RP Tan|Holly Ahel|Prita Asih|Alexander Volkerling|Anne Poljak,Flinders University|Flinders University|Macquarie University|Flinders University|Macquarie University|Flinders University|Flinders University|UNSW Sydney,Contributor(s) Only,Alzheimer's Australia Dementia Research Foundation|Australian Research Council|BrightFocus Foundation|National Health and Medical Research Council,,Medical and health sciences,2022-07-06
An Abundant Mutualist Can Protect Corals From Multiple Stressors,10.5061/dryad.hdr7sqvtd,2148795,Julianna Renzi|Joseph Morton|Jessica Bergman|Devin Rowell|Edwin Iversen Jr.|Leo Gaskins|Juliana Hoehne-Diana|Brian Silliman,"University of California, Santa Barbara|Duke University|UNSW Sydney|The University of Queensland|Duke University|Duke University|University of California, Santa Barbara|Duke University",Contributor(s) Only,National Science Foundation|Foundation For The Carolinas|Duke University,Predation|Climate change|Acropora|Great Barrier Reef|acute tissue loss|Cyclodius,Biological sciences,2025-01-13
Australia’s Tinderbox Drought: An extreme natural event likely worsened by human-caused climate change,10.5061/dryad.12jm63z4q,28544807429,Anjana Devanand|Georgina Falster|Zoe Gillett|Sanaa Hobeichi|Chiara Holgate|Chenhui Jin|Mengyuan Mu|Tess Parker|Sami Rifai|Kathleen Rome|Milica Stojanovic|Elisabeth Vogel|Nerilie Abram|Gab Abramowitz|Sloan Coats|Jason Evans|Allie Gallant|Andy Pitman|Scott Power|Surendra Rauniyar|Andréa Taschetto|Anna Ukkola,UNSW Sydney|Australian National University|UNSW Sydney|UNSW Sydney|Australian National University|Monash University|UNSW Sydney|Monash University|UNSW Sydney|UNSW Sydney|Universidade de Vigo|UNSW Sydney|Australian National University|UNSW Sydney|University of Hawaiʻi at Mānoa|UNSW Sydney|Monash University|UNSW Sydney|University of Southern Queensland|Bureau of Meteorology|UNSW Sydney|UNSW Sydney,Creator and Contributor(s),Xunta de Galicia|Australian Research Council|Australian Government,Climate Processes|Drought|Tinderbox Drought,Earth and related environmental sciences,2024-02-15
Axiom canine microarray data from Australian dingoes and domestic dogs for admixture and population structure analysis,10.5061/dryad.vq83bk3ww,6631021273,Kylie M. Cairns|Mathew S. Crowther|Heidi G. Parker|Elaine A. Ostrander|Mike Letnic,UNSW Sydney|The University of Sydney|National Human Genome Research Institute|National Human Genome Research Institute|UNSW Sydney,Creator and Contributor(s),Dingo Discovery and Research Centre,wild dog |Canis dingo|Axiom CanineHD|dingo|Axiom array SNP data|Canis spp.|population structure |wild dog| conservation|Hybridization|dog|admixter,Biological sciences,2023-05-31
Batesian mimicry converges towards inaccuracy in myrmecomorphic spiders,10.5061/dryad.18931zd45,224478122,Michael Kelly|Shahan Derkarabetian|Donald McLean|Ryan Shofner|Cristian Grismado|Charles Haddad|Gerasimos Cassis|Gonzalo Giribet|Marie Herberstein|Jonas Wolff,Universität Greifswald|Harvard Bioscience (United States)|Macquarie University|UNSW Sydney|Bernardino Rivadavia Natural Sciences Museum|University of the Free State|UNSW Sydney|Harvard Bioscience (United States)|Universität Hamburg|Universität Greifswald,Contributor(s) Only,Australian Research Council,Salticidae|Myrmarachnini|macro-evolution|Corinnidae|trait evolution|Castianeirinae|Araneae,Natural sciences,2025-06-17
Behavioral responses of terrestrial mammals to COVID-19 lockdowns,10.5061/dryad.c59zw3rbd,63919277,Marlee Tucker|Aafke Schipper|Tempe Adams|Nina Attias|Tal Avgar|Natarsha Babic|Kristin Barker|Guillaume Bastille-Rousseau|Domink Behr|Jerrold Belant|Dean Beyer|Niels Blaum|J. David Blount|Dirk Bockmühl|Ricardo Luiz Pires Boulhosa|Michael Brown|Bayarbaatar Buuveibaatar|Francesca Cagnacci|Justin Calabrese|Rok Černe|Simon Chamaillé-Jammes|Aung Nyein Chan|Michael Chase|Yannick Chaval|Yvette Chenaux-Ibrahim|Seth Cherry|Duško Ćirović|Emrah Çoban|Eric Cole|Laura Conlee|Alyson Courtemanch|Gabriele Cozzi|Sarah Davidson|Darren DeBloois|Nandinsetseg Dejid|Vickie DeNicola|Arnaud Desbiez|Iain Douglas-Hamilton|David Drake|Michael Egan|Jasper Eikelboom|William Fagen|Morgan Farmer|Julian Fennessy|Shannon Finnegan|Christen Fleming|Bonnie Fournier|Nicholas Fowler|Mariela Gantchoff|Alexandre Garnier|Benedikt Gehr|Chris Geremia|Jacob Goheen|Morgan Hauptfleisch|Mark Hebblewhite|Morten Heim|Anne Hertel|Marco Heurich|A. J. Mark Hewison|James Hodson|Nicholas Hoffman|Grant Hopcraft|Djuro Huber|Edmund Isaac|Karolina Janik|Miloš Ježek|Örjan Johansson|Neil Jordan|Petra Kaczensky|Douglas Kamaru|Matthew Kauffman|Todd Kautz|Roland Kays|Allicia Kelly|Jonas Kindberg|Miha Krofel|Josip Kusak|Clayton Lamb|Tayler LaSharr|Peter Leimgruber|Horst Leitner|Michael Lierz|John Linnell|Purevjav Lkhagvaja|Ryan Long|José Vicente López-Bao|Matthias-Claudio Loretto|Pascal Marchand|Hans Martin|Lindsey Martinez|Roy McBride Jr.|Ashley McLaren|Erling Meisingset|Joerg Melzheimer|Evelyn Merrill|Arthur Middleton|Kevin Monteith|Seth Moore|Bram Van Moorter|Nicolas Morellet|Thomas Morrison|Rebekka Müller|Atle Mysterud|Michael Noonan|David O'Connor|Daniel Olson|Kirk Olson|Anne Ortega|Federico Ossi|Manuela Panzacchi|Robert Pratchett|Brent Patterson|Rogerio Cunha de Paula|John Payne|Wibke Peters|Tyler Petroelje|Benjamin Pitcher|Boštjan Pokorny|Kim Poole|Hubert Potočnik|Marie-Pier Poulin|Robert Pringle|Herbert Prins|Nathan Ranc|Slaven Reljić|Benjamin Robb|Ralf Röder|Christer Rolandsen|Christian Rutz|Albert Salemgareyev|Gustaf Samelius|Heather Sayine-Crawford|Sarah Schooler|Çağan Şekercioğlu|Nuria Selva|Paola Samenzato|Agnieszka Sergiel|Koustubh Sharma|Avery Shawler|Johannes Signer|Václav Silovský|João Paulo Silva|Richard Simon|Rachel Smiley|Douglas Smith|Erling Solberg|Diego Ellis-Soto|Orr Spiegel|Jared Stabach|Jenna Stacy-Dawes|Daniel Stahler|John Stephenson|Cheyenne Stewart|Olav Strand|Peter Sunde|Nathan Svoboda|Jonathan Swart|Jeffrey Thompson|Katrina Toal|Kenneth Uiseb|Meredith VanAcker|Marianela Velilla|Tana Verzuh|Bettina Wachter|Jesse Whittington|Martin Wikelski|Christopher Wilmers|George Wittemyer|Julie Young|Filip Zięba|Tomasz Zwijacz-Kozica|Mark Huijbregts|Thomas Mueller,"Radboud University Nijmegen|Radboud University Nijmegen|Elephants Without Borders|Instituto de Conservação de Animais Silvestres|Utah State University|Monash University|University of California, Berkeley|Southern Illinois University Carbondale|University of Zurich|Michigan State University|Michigan State University|University of Potsdam|University of Utah|Leibniz Institute for Zoo and Wildlife Research|Instituto Pró-Carnívoros|Giraffe Conservation Foundation|Wildlife Conservation Society, Mongolia Program|Fondazione Edmund Mach|Center for Advanced Systems Understanding|Slovenia Forest Service|Centre National de la Recherche Scientifique|Colorado State University|Elephants Without Borders|Université de Toulouse|Grand Portage Band of Lake Superior Chippewa|Parks Canada|University of Belgrade|KuzeyDoğa Society|United States Fish and Wildlife Service|Missouri Department of Conservation|Wyoming Game and Fish Department|University of Zurich|Max Planck Institute of Animal Behavior|Utah Division of Wildlife Resources|Senckenberg Biodiversity and Climate Research Centre|White Buffalo Inc.|Instituto de Conservação de Animais Silvestres|Save the Elephants|University of Wisconsin–Madison|Southern Illinois University Carbondale|Wageningen University & Research|University of Maryland, College Park|University of Wisconsin–Madison|Giraffe Conservation Foundation|State University of New York|University of Maryland, College Park|Government of Northwest Territories|State University of New York|State University of New York|Université de Toulouse|University of Zurich|Yellowstone National Park|University of Wyoming|Namibia University of Science and Technology|University of Montana|Norwegian Institute for Nature Research|Ludwig-Maximilians-Universität München|Bavarian Forest National Park|Université de Toulouse|Government of Northwest Territories|Pennsylvania Department of Military and Veterans Affairs|University of Glasgow|University of Zegreb|Grand Portage Band of Lake Superior Chippewa|New York City Department of Parks & Recreation|Czech University of Life Sciences Prague|Swedish University of Agricultural Sciences|UNSW Sydney|University of Inland Norway|University of Wyoming|University of Wyoming|State University of New York|North Carolina Museum of Natural Sciences|Government of Northwest Territories|Norwegian Institute for Nature Research|University of Ljubljana|University of Zagreb|University of Alberta|University of Wyoming|Smithsonian National Zoo and Conservation Biology Institute|Büro für Wildökologie und Forstwirtschaft|Justus-Liebig-Universität Gießen|Norwegian Institute for Nature Research|Snow Leopard Conservation Foundation|University of Idaho|Universidad de Oviedo|Max Planck Institute of Animal Behavior|Office Français de la Biodiversité, Direction de la Recherche et de l'Expertise, Unité Ongulés Sauvage|University of Montana|Princeton University|Faro Moro Eco Research, Estancia Faro Moro, Departmento de Boquerón|Trent University|Norwegian Institute of Bioeconomy Research|Leibniz Institute for Zoo and Wildlife Research|University of Alberta|University of California, Berkeley|University of Wyoming|Grand Portage Band of Lake Superior Chippewa|Norwegian Institute for Nature Research|Université de Toulouse|University of Glasgow|Leibniz Institute for Zoo and Wildlife Research|University of Oslo|University of British Columbia|Save Giraffe Now|Utah Division of Wildlife Resources|Wildlife Conservation Society Mongolia Program|University of Wyoming|Fondazione Edmund Mach|Norwegian Institute for Nature Research|University of St Andrews|Trent University|Instituto Chico Mendes de Conservação da Biodiversidade|University of Veterinary Medicine Vienna|Bavarian State Institute for Forestry|State University of New York|Taronga Conservation Society Australia|Faculty of Environmental Protection, Slovenia|Aurora Wildlife Research|University of Ljubljana|University of Wyoming|Princeton University|Wageningen University & Research|Fondazione Edmund Mach|University of Zagreb|University of Wyoming|Leibniz Institute for Zoo and Wildlife Research|Norwegian Institute for Nature Research|University of St Andrews|Association for the Conservation of Biodiversity of Kazakhstan (ACBK)|Snow Leopard Trust|Government of Northwest Territories|State University of New York|University of Utah|Institute of Nature Conservation|Dimension Research, Ecology and Enviornment (D.R.E.Am. Italia)|Institute of Nature Conservation|Snow Leopard Trust|University of California, Berkeley|University of Göttingen|Czech University of Life Sciences Prague|Universidade do Porto|New York Department of Parks and Recreation|University of Wyoming|Yellowstone National Park|Norwegian Institute for Nature Research|Yale University|Tel Aviv University|Smithsonian National Zoo and Conservation Biology Institute|San-Diego Zoo Wildlife Alliance|Yellowstone National Park|Grand Teton National Park|Wyoming Game and Fish Department|Norwegian Institute for Nature Research|Aarhus University|Alaska Department of Fish and Game|Welgevonden Game Reserve|Guyra Paraguay|New York City Department of Parks and Recreation|Ministry of Environment, Forestry and Tourism, Windhoek|Columbia University|Guyra Paraguay|University of Wyoming|Leibniz Institute for Zoo and Wildlife Research|Park Canada, Banff National Park Resource Conservation|Max Planck Institute of Animal Behavior|University of California, Santa Cruz|Colorado State University|National Wildlife Health Center|Tatra National Park|Tatra National Park|Radboud University Nijmegen|Senckenberg Biodiversity and Climate Research Centre",Contributor(s) Only,"Bernd Thies-Stiftung|National Geographic Society|United States-Israel Binational Science Foundation|i-Site MUSE*|Dutch Research Council|Ministry of Education, Science and Technological Development|Slovenian Research Agency|Natural Sciences and Engineering Research Council|Liber Ero Foundation|Radboud Excellence Initiative*|Federal Ministry of Education and Research|Plitvice Lakes National Park*|Swiss National Science Foundation|Ministry of Agriculture|Israeli Science Foundation*|Scientific and Technological Research Council of Turkey|Consejo Nacional de Ciencia y Tecnología|USDA Hatch Act Formula Funding*|Ministry of Education Youth and Sports|European Commission|Ministry of Agriculture, Forestry and Food, Slovenia*|Deutsche Forschungsgemeinschaft|Fondation Segré*|National Science Foundation|Aage V. Jensen Naturfond*|Spanish Ministry of Economy, Industry and Competitiveness*|Gordon and Betty Moore Foundation|Sigrid Rausing Trust*|Paklenica National park*|European Research Council|Gobierno del Principado de Asturias|UK Wolf Conservation Trust*|Agence Nationale de la Recherche",movement ecology|anthropause|COVID-19|mammal|Anthropocene,Biological sciences,2023-06-08
Belowground ecosystem engineers enhance biodiversity and function in a polluted ecosystem,10.5061/dryad.vx0k6djv5,132958,Ana Bugnot|Paul Gribben|Wayne O'Connor|Katherine Erickson|Ross Coleman|Katherine Dafforn,The University of Sydney|UNSW Sydney|New South Wales Department of Primary Industries|UNSW Sydney|The University of Sydney|Macquarie University,Contributor(s) Only,,Remediation|urbanisation|Pollution|ecosystem engineer|bioturbation|sediments,Earth and related environmental sciences,2022-05-20
Best of both worlds: Acclimation to fluctuating environments confers advantages and minimizes costs of constant environments,10.5061/dryad.tdz08kq31,330806,Mitchell Hodgson|Lisa Schwanz,UNSW Sydney|UNSW Sydney,Creator and Contributor(s),Australian Research Council|UNSW Sydney|Australian Government,Lizards|plasticity|thermal physiology,Biological sciences,2024-01-30
Bio-inspired forward and backward swimming gaits resulting from fluid-structure interactions,10.5061/dryad.cz8w9gj9q,6169938491,Chhote Lal Shah|Karthick Dhileep|Qiuxiang Huang|Sridhar Ravi|Sunetra Sarkar,Indian Institute of Technology Madras|UNSW Sydney|Queensland University of Technology|UNSW Sydney|Indian Institute of Technology Madras,Contributor(s) Only,,Backward swimmer|Forward swimmer|Fluid-structure interactions|Efficient swimming,Engineering and technology,2025-01-02
Bisulfite sequencing (RRBS-seq): CpG methylation reports for Australian invasive cane toads,10.5061/dryad.pk0p2ngmv,211273029299,Roshmi Rekha Sarma|Michael R Crossland|Harrison J.F Eyck|Jayna L DeVore|Richard J Edwards|Michael Cocomazzo|Jia Zhou|Gregory P Brown|Richard Shine|Lee Ann Rollins,UNSW Sydney|UNSW Sydney|UNSW Sydney|The University of Sydney|UNSW Sydney|Deakin University|UNSW Sydney|Macquarie University|Macquarie University|UNSW Sydney,Creator and Contributor(s),Australian Research Council,Cane toad|RRBS,Biological sciences,2021-03-23
Brown-throated parakeet vocalization data,10.5061/dryad.k3j9kd58b,57754986,Jessica Eberhard|Irene Zager|Jose Ferrer-Paris|Kathryn Rodriguez-Clark,Louisiana State University|Instituto Venezolano de Investigaciones Científicas|UNSW Sydney|Instituto Venezolano de Investigaciones Científicas,Contributor(s) Only,Fondo Nacional de Ciencia Tecnología e Innovación|National Geographic Society,,,2021-11-01
Can developmental plasticity shape sexual competition and promote reproductive isolation?,10.5061/dryad.xksn02vq2,26120,Kristin Hubakk|Zachariah Wylde|Russell Bonduriansky,UNSW Sydney|UNSW Sydney|UNSW Sydney,Creator and Contributor(s),Australian Research Council,development|Telostylinus angusticollis|Sexual selection|Insects|Environmental variation|Evolution|plasticity|reproductive isolation|Neriidae|Ecology,Biological sciences,2024-05-29
Can native predators be used as a stepping stone to reduce prey naivety to novel predators?,10.5061/dryad.pzgmsbcqk,106204,Leanne Van der Weyde|Daniel Blumstein|Michael Letnic|Katherine Tuft|Ned Ryan-Schofield|Katherine Moseby,"UNSW Sydney|University of California, Los Angeles|UNSW Sydney|Arid Recovery|The University of Adelaide|UNSW Sydney",Creator and Contributor(s),Australian Research Council,marsupial|predator-prey|neophobia|greater bilby|Anti-predator trait,Biological sciences,2022-10-19
Can sexual conflict drive transitions to asexuality? Female resistance to fertilization in a facultatively parthenogenetic insect,10.5061/dryad.k98sf7mhf,58997,Daniela Wilner|Jigmidmaa Boldbaatar|Soleille Miller|Nathan Burke|Russell Bonduriansky,UNSW Sydney|UNSW Sydney|UNSW Sydney|Universität Hamburg|UNSW Sydney,Creator and Contributor(s),Australian Research Council,stick-insects|geographical parthenogenesis|facultative parthenogenesis|female resistance|thelytoky|Megacrania batesii|Sexual conflict|Parthenogenesis|reproductive isolation|phasmid,Biological sciences,2024-12-31
"Climate change, sex reversal, and lability of sex determining systems",10.5061/dryad.cnp5hqc1t,399439,Lisa Schwanz|Arthur Georges|Clare Holleley|Stephen Sarre,UNSW Sydney|University of Canberra|Commonwealth Scientific and Industrial Research Organisation|University of Canberra,Creator Only,,Reptiles|Pogona|temperature-dependent sex determination,,2020-01-10
"Clinical, technical, and implementation characteristics of real-world health applications using FHIR",10.5061/dryad.qrfj6q5k5,3191806,Ashley Griffin|Lu He|Anthony Sunjaya|Andrew King|Zubin Khan|Martin Nwadiugwu|Brian Douthit|Vignesh Subbian|Viet Nguyen|Mark Braunstein|Charles Jaffe|Titus Schleyer,"Stanford University|University of California, Irvine|UNSW Sydney|University of Pittsburgh|Centers for Disease Control and Prevention|Tulane University|Vanderbilt University|University of Arizona|Health Level Seven International|Georgia Institute of Technology|Health Level Seven International|Regenstrief Institute",Contributor(s) Only,,Medical Informatics|Health Information Interoperability|Fast Healthcare Interoperability Resources|FHIR|Application Programming Interface,Computer and information sciences,2022-09-16
Co-expression of calcium and hERG potassium channels reduces the incidence of proarrhythmic events,10.5061/dryad.612jm640k,507837731,Jamie Vandenberg|Sara Ballouz|Melissa M Mangala|Matthew D Perry|Stewart Heitmann|Jesse A Gillis|Adam P Hill|Jamie I Vandenberg,UNSW Sydney|Cold Spring Harbor Laboratory|Victor Chang Cardiac Research Institute|Victor Chang Cardiac Research Institute|Victor Chang Cardiac Research Institute|Cold Spring Harbor Laboratory|Victor Chang Cardiac Research Institute|Victor Chang Cardiac Research Institute,Creator Only,National Health and Medical Research Council,,,2021-02-22
Collision between biological process and statistical analysis revealed by mean-centering,10.5061/dryad.sj3tx9632,3022329,David Westneat|Yimen Araya-Ajoy|Hassen Allegue|Barbara Class|Niels Dingemanse|Ned Dochtermann|Laszlo Garamszegi|Julien Martin|Shinichi Nakagawa|Denis Reale|Holger Schielzeth,University of Kentucky|Norwegian University of Science and Technology|Université du Québec à Montréal|University of the Sunshine Coast|Ludwig-Maximilians-Universität München|North Dakota State University|Hungarian Academy of Sciences|University of Ottawa|UNSW Sydney|Université du Québec à Montréal|Bielefeld University,Contributor(s) Only,"Centre for Population Biology at NTNU*|Volkswagen Foundation|Max Planck Research School for Organismal Biology|Max Planck Research School for Organismal Biology*|Ecosyste GINOP of the Centre for Ecological Research*|Centre d'Ecologie Fonctionelle and Evolutive, Montpellier|National Science Foundation|Centre for Population Biology at NTNU|Ecosyste GINOP of the Centre for Ecological Research|Centre d'Ecologie Fonctionelle and Evolutive, Montpellier*",linear mixed-effects models|model design|parameter misestimation|bivariate models|hierarchical causation|environmental effects,Biological sciences,2020-09-08
Condition-dependence of phenotypic integration and the evolvability of genitalic traits in a neriid fly,10.5061/dryad.zw3r2285b,239723,Zachariah Wylde|Russell Bonduriansky,UNSW Sydney|UNSW Sydney,Creator and Contributor(s),Australian Research Council,,,2021-07-09
Conspicuous animal signals avoid the cost of predation by being intermittent or novel: confirmation in the wild using hundreds of robotic prey,10.5061/dryad.mkkwh70z5,125741,Terry Ord,UNSW Sydney,Creator Only,UNSW Sydney,colourful ornamentation|Draco sumatranus|aposematic signal|prey mimic|predator attack|Warning signal|robotic prey|conspicuous behaviour,Biological sciences,2021-06-10
