title,doi,storage_size,authors,affiliations,author_order,funders,keywords,fieldOfScience,publication_date
"Data from: Livestock activity increases exotic plant richness, but wildlife increases native richness, with stronger effects under low productivity",10.5061/dryad.851d0,110483,David J. Eldridge|Manuel Delgado-Baquerizo|Samantha K. Travers|James Val|Ian Oliver|Josh W. Dorrough|Santiago Soliveres,UNSW Sydney|University of Colorado Boulder|UNSW Sydney|University of Bern|University of New England|University of New England|University of Bern,Creator and Contributor(s),,Herbivore activity|Semi-arid woodland|structural equation modelling|Callitris glaucophylla|Holocene|Eucalyptus largiflorens|kangaroo|Eucalyptus camaldulensis,,2018-07-19
Data from: Livestock grazing reinforces the competitive exclusion of small-bodied birds by large aggressive birds,10.5061/dryad.h2s76,50861,James Val|David J. Eldridge|Samantha K. Travers|Ian Oliver,NSW Office of Environment & Heritage|UNSW Sydney|UNSW Sydney|University of New England,Contributor(s) Only,,woodland birds|Richness|livestock grazing|interspecific competition|Manorina miners|habitat complexity,,2018-12-01
Data from: Longitudinal cognitive and biomarker changes in dominantly inherited Alzheimer disease,10.5061/dryad.f6sj385,387213,Eric McDade|Guoqiao Wang|Brian Andrew Gordon|Jason Hassenstab|Tammie L.S. Benzinger|Virginia Buckles|Anne M. Fagan|David M. Holtzman|Nigel J. Cairns|Alison M. Goate|Daniel S. Marcus|John C. Morris|Katrina Paumier|Chengjie Xiong|Ricardo Allegri|Sarah B. Berman|William Klunk|James Nobel|John Ringman|Bernardino Ghetti|Martin Farlow|Reisa Anne Sperling|Jasmeer Chhatwal|Stephen Salloway|Neil R. Graff-Radford|Peter R. Schofield|Colin Masters|Martin N. Rossor|Nick C. Fox|Johannes Levin|Mathias Jucker|Randall J. Bateman,"|Department of Neurology, Division of Biostatistics, Department of Radiology, and Department of Pathology, Washington University School of Medicine, Saint Louis, MO|Department of Neurology, Division of Biostatistics, Department of Radiology, and Department of Pathology, Washington University School of Medicine, Saint Louis, MO|Department of Neurology, Division of Biostatistics, Department of Radiology, and Department of Pathology, Washington University School of Medicine, Saint Louis, MO|Department of Neurology, Division of Biostatistics, Department of Radiology, and Department of Pathology, Washington University School of Medicine, Saint Louis, MO|Department of Neurology, Division of Biostatistics, Department of Radiology, and Department of Pathology, Washington University School of Medicine, Saint Louis, MO|Department of Neurology, Division of Biostatistics, Department of Radiology, and Department of Pathology, Washington University School of Medicine, Saint Louis, MO|Department of Neurology, Division of Biostatistics, Department of Radiology, and Department of Pathology, Washington University School of Medicine, Saint Louis, MO|Department of Neurology, Division of Biostatistics, Department of Radiology, and Department of Pathology, Washington University School of Medicine, Saint Louis, MO||Department of Neurology, Division of Biostatistics, Department of Radiology, and Department of Pathology, Washington University School of Medicine, Saint Louis, MO|Department of Neurology, Division of Biostatistics, Department of Radiology, and Department of Pathology, Washington University School of Medicine, Saint Louis, MO|Department of Neurology, Division of Biostatistics, Department of Radiology, and Department of Pathology, Washington University School of Medicine, Saint Louis, MO|Department of Neurology, Division of Biostatistics, Department of Radiology, and Department of Pathology, Washington University School of Medicine, Saint Louis, MO|Fundación para la Lucha contra las Enfermedades Neurológicas de la Infancia|University of Pittsburgh|University of Pittsburgh|Columbia University|University of Southern California|Indiana University|Indiana University|Massachusetts General Hospital|Massachusetts General Hospital|Butler Hospital|Department of Neurology, Mayo Clinic Jacksonville, FL|UNSW Sydney|The University of Melbourne|UCL Biomedical Research Centre|UCL Biomedical Research Centre|Ludwig-Maximilians-Universität München|Hertie Institute for Clinical Brain Research|Department of Neurology, Division of Biostatistics, Department of Radiology, and Department of Pathology, Washington University School of Medicine, Saint Louis, MO",Contributor(s) Only,,Genetics|Alzheimer's disease|Imaging,,2019-07-06
Data from: Male-female chemical interactions in a facultatively parthenogenetic stick insect,10.5061/dryad.sf7m0cgdr,48113,Wai Chi Vicky Ying|Daniela Wilner|Lewis Adler|Zachariah Wylde|Russell Bonduriansky,UNSW Sydney|UNSW Sydney|UNSW Sydney|UNSW Sydney|UNSW Sydney,Creator and Contributor(s),Australian Research Council,Animal antennae|CHC analysis|allometry|sensilla density|CHC extraction|pheromone behavioural trials,Biological sciences,2024-06-13
Data from: Mammalian engineers drive soil microbial communities and ecosystem functions across a disturbance gradient,10.5061/dryad.3936j,49023,David J. Eldridge|Manuel Delgado-Baquerizo|Jason N. Woodhouse|Brett A. Nielan,UNSW Sydney|Western Sydney University|School of Biotechnology and Biomolecular Sciences; University of NSW; Sydney NSW 2052 Australia|School of Biotechnology and Biomolecular Sciences; University of NSW; Sydney NSW 2052 Australia,Creator Only,,Microbes|Rabbits|Tachyglossus aculeatus|animal foraging|Holocene|arid|Oryctolagus cuniculus|soil disturbance,,2017-07-12
Data from: Manipulation of habitat isolation and area implicates deterministic factors and limited neutrality in community assembly,10.5061/dryad.55nh5,136768,Terry J. Ord|Jack Emblen|Mattias Hagman|Ryan Shofner|Sara Unruh,UNSW Sydney|UNSW Sydney|UNSW Sydney|UNSW Sydney|UNSW Sydney,Creator and Contributor(s),,edge effect|Invertebrate|niche theory|Holocene|field experiment|vertebrate,,2018-05-15
Data from: Maternal effects impact decision-making in a viviparous lizard,10.5061/dryad.01vc6,225951,Kirke L. Munch|Daniel W.A. Noble|Thomas Botterill-James|Iain S. Koolhof|Ben Halliwell|Erik Wapstra|Geoffrey M. While|Daniel W. A. Noble,University of Tasmania|University of Tasmania|University of Tasmania|University of Tasmania|University of Tasmania|University of Tasmania|University of Tasmania|UNSW Sydney,Contributor(s) Only,,developmental stress|information bias|Reptiles|Liopholis whitii,,2018-03-26
Data from: Maternal presence facilitates plasticity in offspring behavior: insights into the evolution of parental care,10.5061/dryad.9vv1vb6,104655,Kirke L. Munch|Daniel W.A. Noble|Luke Budd|Aryana Row|Erik Wapstra|Geoffrey M. While|Daniel W A Noble,University of Tasmania|University of Tasmania|University of Tasmania|University of Tasmania|University of Tasmania|University of Tasmania|University of Tasmania,Unknown,,Liopholis whitii|reptile|Holocene|present,,2018-09-04
Data from: Mesopredator suppression by an apex predator alleviates the risk of predation perceived by small prey,10.5061/dryad.hf7gg,35700,Christopher E. Gordon|Anna Feit|Jennifer Grüber|Mike Letnic|J. Gruber,Western Sydney University|UNSW Sydney|UNSW Sydney|UNSW Sydney|UNSW Sydney,Contributor(s) Only,,Canis dingo|dingo|non-lethal effects|Giving Up Density|Trophic|Current day|Felis catus|Notomys fuscus,,2015-01-13
Data from: Microbial richness and composition independently drive soil multifunctionality,10.5061/dryad.h5q34,144376,Manuel Delgado-Baquerizo|Pankaj Trivedi|Chanda Trivedi|David J. Eldridge|Peter B. Reich|Thomas C. Jeffries|Brajesh K. Singh,Western Sydney University|Colorado State University|Western Sydney University|UNSW Sydney|Western Sydney University|Western Sydney University|Western Sydney University,Contributor(s) Only,,Enzyme activities|Terrestrial ecosystems|BEF relationship,,2018-06-09
Data from: Moa diet fits the bill: virtual reconstruction incorporating mummified remains and prediction of biomechanical performance in avian giants,10.5061/dryad.hf0rm,675804336,Marie R. G. Attard|Laura A. B. Wilson|Trevor H. Worthy|Paul Scofield|Peter Johnston|William C. H. Parr|Stephen Wroe,University of New England|UNSW Sydney|Flinders University|Canterbury Museum|University of Auckland|UNSW Sydney|University of New England,Contributor(s) Only,,Casuarius casuarius|Anomalopteryx didiformis|Euryapteryx curtus|Pachyornis australis|Dinornithiformes|Quaternary|moa|Dinornis robustus|ratite|Dromaius novaehollandiae|Megalapteryx didinus|FEA|Finite element analysis,,2015-12-10
Data from: Modeling the dynamics of Plasmodium vivax infection and hypnozoite reactivation in vivo,10.5061/dryad.j6m20,126816,Adeshina I. Adekunle|Mykola Pinkevych|Rose McGready|Christine Luxemburger|Lisa J. White|Francois Nosten|Deborah Cromer|Miles P. Davenport,UNSW Sydney|UNSW Sydney|University of Oxford|Mahidol University|University of Oxford|University of Oxford|UNSW Sydney|UNSW Sydney,Creator and Contributor(s),,P. vivax infection|Malaria|Primaquine|hypnozoites|Plasmodium vivax,,2016-02-10
Data from: Modes of berm and beachface recovery following storm reset: observations using a continuously scanning lidar,10.5061/dryad.774c492,785630,Matthew S. Phillips|Chris E. Blenkinsopp|Kristen D. Splinter|Mitchell D. Harley|Ian L. Turner,UNSW Sydney|UNSW Sydney|UNSW Sydney|UNSW Sydney|UNSW Sydney,Creator and Contributor(s),,accretion|Narrabeen-Collaroy|beachface|berm growth|beach recovery|22 April - 7 July 2015,,2019-02-25
Data from: Monitoring large and complex wildlife aggregations with drones,10.5061/dryad.m4r0cn0,558365124,Mitchell B. Lyons|Kate J. Brandis|Nick J. Murray|John H. Wilshire|Justin A. McCann|Richard T. Kingsford|Corey T. Callaghan,UNSW Sydney|UNSW Sydney|UNSW Sydney|UNSW Sydney|UNSW Sydney|UNSW Sydney|UNSW Sydney,Creator and Contributor(s),,Breeding|drone|colonial|imagery,,2019-05-31
Data from: MR1-restricted mucosal-associated invariant T (MAIT) cells respond to mycobacterial vaccination and infection in nonhuman primates,10.5061/dryad.vm36c,101063,Justin M. Greene|Pradyot Dash|Sobhan Roy|Curtis McMurtrey|Walid Awad|Jason S. Reed|Katherine B. Hammond|Shaheed Abdulhaqq|Helen L. Wu|Benjamin J. Burwitz|Benjamin F. Roth|David W. Morrow|Julia C. Ford|Guangwu Xu|Joseph Y. Bae|Hugh Crank|Alfred W. Legasse|Thurston H. Dang|Hui Yee Greenaway|Monica Kurniawan|Marielle C. Gold|Melanie J. Harriff|Deborah A. Lewinsohn|Byung S. Park|Michael K. Axthelm|Jeffrey J. Stanton|Scott G. Hansen|Louis J. Picker|Vanessa Venturi|William Hildebrand|Paul G. Thomas|David M. Lewinsohn|Erin J. Adams|Jonah B. Sacha,Oregon National Primate Research Center|||University of Oklahoma Health Sciences Center|St. Jude Children's Research Hospital|Oregon National Primate Research Center|Oregon National Primate Research Center|Oregon National Primate Research Center|Oregon National Primate Research Center|Oregon National Primate Research Center|Oregon National Primate Research Center|Oregon National Primate Research Center|Oregon National Primate Research Center||Oregon National Primate Research Center|Oregon National Primate Research Center|Oregon National Primate Research Center|UNSW Sydney|UNSW Sydney|UNSW Sydney|Oregon Health & Science University|Oregon Health & Science University||Oregon National Primate Research Center|Oregon National Primate Research Center|Oregon National Primate Research Center|Oregon National Primate Research Center|Oregon National Primate Research Center|UNSW Sydney|University of Oklahoma Health Sciences Center|St. Jude Children's Research Hospital|Oregon Health & Science University|University of Chicago|Oregon National Primate Research Center,Contributor(s) Only,,T cell receptor|Macaca mulatta|Macaque|MAIT|TRDV|MR1|Rhesus Macaque|mucosal-associated invariant T cells|TRAV|non-human primates|TRAJ,,2017-09-07
Data from: Multiple biological mechanisms result in correlations between pre- and post-mating traits that differ among versus within individuals and genotypes,10.5061/dryad.34jf146,321302,Cristina Tuni|Chang S. Han|Niels J. Dingemanse,Ludwig-Maximilians-Universität München|UNSW Sydney|Ludwig-Maximilians-Universität München,Contributor(s) Only,,life history trade-offs|Gryllus bimaculatus|genetic quality|male contest competition|trait correlations|ejaculate expenditure,,2018-07-27
Data from: Natural selection in novel environments: predation selects for background matching in the body colour of a land fish,10.5061/dryad.kp815,47393,Courtney L. Morgans|Terry J. Ord,UNSW Sydney|UNSW Sydney,Creator and Contributor(s),,colour|present day|crypsis|adaptive evolution|invasion success|camouflage|Pacific leaping blenny|Alticus arnoldorum,,2014-10-14
Data from: Near-infrared spectroscopy for metabolite quantification and species identification,10.5061/dryad.324ch00,2280595,Wen Chyuan Aw|J. William Ballard,UNSW Sydney|UNSW Sydney,Creator and Contributor(s),,Metabolite level|species identification|non-invasive|High-througput,,2019-02-06
Data from: NIHSS cut-point for predicting outcome in supra- vs infra-tentorial acute ischemic stroke,10.5061/dryad.1kn74rt,331568,Sohei Yoshimura|Richard I. Lindley|Cheryl Carcel|Shoichiro Sato|Candice Delcourt|Xia Wang|John Chalmers|Craig S. Anderson,UNSW Sydney|Westmead Hospital|UNSW Sydney|UNSW Sydney|UNSW Sydney|UNSW Sydney|UNSW Sydney|UNSW Sydney,Creator and Contributor(s),,MRI|Infarction|NIHSS,,2019-07-26
Data from: On-shelf larval retention limits population connectivity in a coastal broadcast spawner,10.5061/dryad.n9v91,201929,Peter R. Teske|Jonathan Sandoval-Castillo|Erik van Sebille|Jonathan Waters|Luciano B. Beheregaray|LB Beheregaray|PR Teske,|Flinders University|UNSW Sydney|University of Otago||Flinders University|University of Johannesburg,Contributor(s) Only,,Marine ecology|Planktonic larval duration|MPA|population genetic structure|Holocene|IBD|Marine protected areas|Nerita atramentosa|isolation by distance|seascape genetics,,2015-08-04
"Data from: Ontogenetic timing as a condition-dependent life history trait: high-condition males develop quickly, peak early and age fast",10.5061/dryad.2r4q4,144547,Amy K. Hooper|Foteini Spagopoulou|Zachariah Gilmer Wylde|Alexei A. Maklakov|Russell Bonduriansky|Zachariah Wylde,UNSW Sydney|Uppsala University|UNSW Sydney|Uppsala University|UNSW Sydney|UNSW Sydney,Creator and Contributor(s),,Costs of secondary sexual traits|Reproductive ageing,,2017-01-13
Data from: Ornament size and colour as alternative strategies for effective communication in gliding lizards,10.5061/dryad.0g3d5,22178,Danielle A. Klomp|Terry Ord|Indraneil Das|Arvin Diesmos|Norhayati Ahmad|Devi Stuart-Fox|T. J. Ord,UNSW Sydney|UNSW Sydney|Universiti Malaysia Sarawak|National Museum|National University of Malaysia|The University of Melbourne|UNSW Sydney,Creator and Contributor(s),,Draco|coloration|comparative analyses|visual ecology|lizard,,2016-07-19
"Data from: Palaeoecological inferences for the fossil Australian snakes Yurlunggur and Wonambi (Serpentes, Madtsoiidae)",10.5061/dryad.5gs6p,2894596,Alessandro Palci|Mark N. Hutchinson|Michael W. Caldwell|John D. Scanlon|Michael S.Y. Lee|Michael S. Y. Lee,Flinders University|South Australian Museum|University of Alberta|UNSW Sydney|South Australian Museum|South Australian Museum,Contributor(s) Only,,labyrinth|Yurlunggur|Madtsoiidae|madtsoiid snakes|canonical variates analysis|Serpentes|Wonambi,,2018-02-07
Data from: Particle-association lifestyle is a phylogenetically conserved trait in bathypelagic prokaryotes,10.5061/dryad.t6hh8,5204755,Guillem Salazar Guiral|Francisco Cornejo-Castillo|Encarna Borrull|Cristina Díez-Vives|Elena Lara|Dolors Vaqué|Jesús Arrieta|Carlos Duarte|Josep Gasol|Silvia Acinas,Institut de Ciències del Mar|Institut de Ciències del Mar|Institut de Ciències del Mar|UNSW Sydney|Istituto di Scienze Marine del Consiglio Nazionale delle Ricerche|Institut de Ciències del Mar|King Abdullah University of Science and Technology|King Abdullah University of Science and Technology|Institut de Ciències del Mar|Institut de Ciències del Mar,Contributor(s) Only,,,,2017-09-20
Data from: Perceived threats of infanticide reduce maternal allocation during lactation and lead to elevated oxidative damage in offspring,10.5061/dryad.762k24f,53845,Teagan Gale|Michael Garratt|Robert C. Brooks,UNSW Sydney|University of Michigan Medical School|UNSW Sydney,Creator and Contributor(s),,maternal effects|infanticide|catch-up growth,,2019-05-21
Data from: Perceptual impairment in face identification with poor sleep,10.5061/dryad.r620r,86251,Louise Beattie|Darragh Walsh|Jessica McLaren|Stephany M. Biello|David White,University of Glasgow|University of Glasgow|University of Glasgow|University of Glasgow|UNSW Sydney,Contributor(s) Only,,Face recognition|Sleep deprivation|unfamiliar face matching|Insomnia,,2016-09-07
Data from: Peregrine Falcons shift mean and variance in provisioning in response to increasing brood demand,10.5061/dryad.6hdr7sr6q,2201313,Rebekah McKinnon|Kevin Hawkshaw|Erik Hedlin|Shinichi Nakagawa|Kimberley Mathot,University of Alberta|University of Alberta|University of Alberta|UNSW Sydney|University of Alberta,Contributor(s) Only,Mitacs|Natural Sciences and Engineering Research Council|Government of Nunavut|University of Alberta|Nunavut General Monitoring Plan,raptor|risk-sensitivity|provisioning|Animal behavior|variance-sensitivity ,Biological sciences,2023-12-04
"Data from: Personality-matching habitat choice, rather than behavioural plasticity, is a likely driver of a phenotype–environment covariance",10.5061/dryad.t8t25,378974,Benedikt Holtmann|Eduardo S.A. Santos|Carlos E. Lara|Shinichi Nakagawa|Eduardo S. A. Santos,University of Otago|University of Otago|University of Otago|UNSW Sydney|Universidade de São Paulo,Contributor(s) Only,,genotype-environment covariance|human disturbance|Prunella modularis,,2017-08-21
Data from: Pharmacologic hyperstabilisation of the HIV-1 capsid lattice induces capsid failure,10.5061/dryad.18931zd49,263088303582,James Walsh,UNSW Sydney,Creator Only,Wellcome Trust|Australian Research Council|National Health and Medical Research Council,HIV Capsid|Single Moleculeb TIRF Microscopy|lenacapavir,Biological sciences,2024-03-12
Data from: Photoperiod sensitive plants have lower levels of flowering time advancement,10.5061/dryad.4b8gtht8x,317024,Karen Zeng|Alex Sentinella|Charlotte Armitage|Angela Moles,UNSW Sydney|UNSW Sydney|Woodland Trust|UNSW Sydney,Creator and Contributor(s),Australian Research Council,flowering date|photoperiod-sensitive plant|Flowering plants,Biological sciences,2024-09-05
"Data from: Phylogenetic diversity, types of endemism and the evolutionary history of New World bats",10.5061/dryad.1718129,159620629,Camilo López-Aguirre|Suzanne J. Hand|Shawn W. Laffan|Michael Archer,UNSW Sydney|UNSW Sydney|UNSW Sydney|UNSW Sydney,Creator and Contributor(s),,Noctilionoidea|CANAPE|Emballonuroidea|Chiroptera|Phylogenetic endemism|Vespertilionoidea,,2018-03-09
Data from: Plant traits of propagule banks and standing vegetation reveal flooding alleviates impacts of agriculture on wetland restoration,10.5061/dryad.bp79f,1633402,Samantha K. Dawson|David I. Warton|Richard T. Kingsford|Peter Berney|David A. Keith|Jane A. Catford,National Parks and Wildlife Service|UNSW Sydney|UNSW Sydney|National Parks and Wildlife Service|University of Southampton|The University of Melbourne,Contributor(s) Only,,native species|Sydney|Sourced from the Royal Botanic Gardens|Holocene|flood frequency|community assembly and reassembly|floodplain vegetation|exotic species|seedbank,,2018-04-04
Data from: Point process models for presence-only analysis,10.5061/dryad.985s5,86119500,Ian W. Renner|Jane Elith|Adrian Baddeley|William Fithian|Trevor Hastie|Steven Phillips|Gordana Popovic|David I. Warton,University of Newcastle Australia|The University of Melbourne|Curtin University|Stanford University|Stanford University|School of Mathematics and Statistics and Evolution &amp; Ecology Research Centre The University of New South Wales Sydney NSW 2052 Australia|UNSW Sydney|UNSW Sydney,Contributor(s) Only,,point process models,,2016-02-04
Data from: Population differentiation and behavioural association of the two ‘personality’ genes DRD4 and SERT in dunnocks (Prunella modularis),10.5061/dryad.tp4v3,748424,Benedikt Holtmann|Stefanie Grosser|Malgorzata Lagisz|Sheri R. Johnson|Eduardo S. A. Santos|Carlos E. Lara|Bruce Robertson|Shinichi Nakagawa|S. L. Johnson|B. C. Robertson,University of Otago|University of Otago|UNSW Sydney|University of Otago|Universidade de São Paulo|University of Otago|University of Otago|UNSW Sydney|University of Otago|University of Otago,Contributor(s) Only,,introduced population|serotonin transporter|dopamine recepter D4|Prunella modularis,,2015-12-10
"Data from: Population variation in the life history of a land fish, Alticus arnoldorum, and the effects of predation and density",10.5061/dryad.kd873,41362,Edward R. M. Platt|Terry J. Ord,UNSW Sydney|UNSW Sydney,Creator and Contributor(s),,Population density|land colonisation|Alticus arnoldorum|amphibious fish,,2016-08-20
Data from: Predator exposure improves anti-predator responses in a threatened mammal,10.5061/dryad.kn21m,38569,Rebecca West|Mike Letnic|Daniel T. Blumstein|Katherine E. Moseby,UNSW Sydney|UNSW Sydney|UNSW Sydney|UNSW Sydney,Creator and Contributor(s),,burrowing bettong|prey naïveté|Bettongia leseuer|exotic predator|Bettongia lesueur|in situ predator exposure|anti-predator training,,2018-05-23
Data from: Predicting success of conservation translocations: Prerelease screening tools for a threatened marsupial,10.5061/dryad.95x69p8tg,21388,Kate Cornelsen|Andrew Elphinstone|Neil Jordan,UNSW Sydney|Taronga Conservation Society Australia|UNSW Sydney,Creator and Contributor(s),Australasian Wildlife Genomics Lab*|Taronga Conservation Society Australia|Australian Wildlife Society|Australian Government,Personality|Evolutionary ecology|Personality tests|Animal behavior|Personality traits|Conservation science,Earth and related environmental sciences,2025-05-28
Data from: Predictions of single-nucleotide polymorphism differentiation between two populations in terms of mutual information,10.5061/dryad.5002s,269262,Roderick C Dewar|William B Sherwin|Emma Thomas|Clare E Holleley|Richard A Nichols,Australian National University|Australian National University|Australian National University|UNSW Sydney|UNSW Sydney,Contributor(s) Only,,single nucleotide polymorphism|drift-mutation-dispersal,,2011-06-03
Data from: Primary productivity is related to niche width in the Australian Wet Tropics,10.5061/dryad.hp24b6f,119056,Hugh M. Burley|Karel Mokany|Shawn W. Laffan|Kristen J. Williams|Dan Metcalfe|Helen T. Murphy|Andrew Ford|Tom D. Harwood|Simon Ferrier,Commonwealth Scientific and Industrial Research Organisation|Commonwealth Scientific and Industrial Research Organisation|UNSW Sydney|Commonwealth Scientific and Industrial Research Organisation|Commonwealth Scientific and Industrial Research Organisation|Commonwealth Scientific and Industrial Research Organisation|Commonwealth Scientific and Industrial Research Organisation|Commonwealth Scientific and Industrial Research Organisation|Commonwealth Scientific and Industrial Research Organisation,Contributor(s) Only,,Current - 1970 - 2012|Wet tropics|Holocene|1970 - 2012,,2019-08-27
Data from: Proactive cursorial and ambush predation risk avoidance in four African herbivore species,10.5061/dryad.w0vt4b8zr,37617380,Emily Bennitt|Harriet Bartlam-Brooks|Tatjana Hubel|Neil Jordan|John McNutt|Alan Wilson,University of Botswana|Royal Veterinary College|Royal Veterinary College|UNSW Sydney|WildEntrust|Royal Veterinary College,Contributor(s) Only,European Research Council|Engineering and Physical Sciences Research Council|Biotechnology and Biological Sciences Research Council,predator-prey|Ungulate|risk avoidance|carnivore|Antelope,Natural sciences,2024-05-27
Data from: Profile of and risk factors for post-stroke cognitive impairment in diverse ethno-regional groups,10.5061/dryad.m517990,881737,Jessica W Lo|John D Crawford|David W Desmond|Olivier Godefroy|Hanna Jokinen|Simin Mahinrad|Hee-Joon Bae|Sebastian Köhler|Elles Douven|Julie Staals|Christopher Chen|Xin Xu|Eddie J Chong|Rufus O Akinyemi|Rajesh N Kalaria|Adesola Ogunniyi|Mélanie Barbay|Martine Roussel|Byung-Chul Lee|Velandai K Srikanth|Christopher Moran|Nagaendran Kandiah|Russell J Chander|Behnam Sabayan|J. Wouter Jukema|Susanna Melkas|Timo Erkinjuntti|Henry Brodaty|Régis Bordet|Stéphanie Bombois|Hilde Hénon|Darren M Lipnicki|Nicole A Kochan|Jae-Sung Lim|Perminder S Sachdev,"UNSW Sydney|UNSW Sydney|,|Centre Hospitalier Universitaire Amiens-Picardie|University of Helsinki|Leiden University Medical Center|Seoul National University Bundang Hospital|Maastricht University|Maastricht University|Maastricht University Medical Centre|National University of Singapore|National University of Singapore|National University of Singapore|University of Ibadan|Newcastle University|University of Ibadan|Centre Hospitalier Universitaire Amiens-Picardie|Centre Hospitalier Universitaire Amiens-Picardie|Hallym University Sacred Heart Hospital|Monash University|Monash University|National Neuroscience Institute|UNSW Sydney|Northwestern University|Leiden University Medical Center|University of Helsinki|University of Helsinki|UNSW Sydney|Université de Lille|Université de Lille|Université de Lille|UNSW Sydney|UNSW Sydney|Hallym University Sacred Heart Hospital|UNSW Sydney",Creator and Contributor(s),,post-stroke cognitive impairment|consortium,,2019-11-22
